the_geom,borocode,boroname,borocd,coundist,assemdist,stsendist,congdist,location,borough,date_insta,point_x,point_y,femafldz,femafldt,hrcevac,ntaname
POINT (-73.86567159429882 40.75762073014738),4,Queens,403,21,35,13,14,Northern Boulevard and 103 Street,Queens,2019-08-07T00:00:00.000,-73.865673,40.757629,X,AREA OF MINIMAL FLOOD HAZARD,,North Corona
POINT (-73.74885263083556 40.76402472428716),4,Queens,411,19,26,11,3,Northern Boulevard and 232 Street,Queens,2025-08-28T00:00:00.000,-73.748854,40.764033,AE,,2.0,Douglaston-Little Neck
POINT (-73.73138063666141 40.75960272506274),4,Queens,411,23,26,11,3,Marathon Parkway and  57 Avenue,Queens,2012-05-02T00:00:00.000,-73.731382,40.759611,X,AREA OF MINIMAL FLOOD HAZARD,,Douglaston-Little Neck
POINT (-73.87713458577412 40.82395471721581),2,Bronx,209,18,85,32,14,Bruckner Boulevard North WB and Boynton Avenue,Bronx,2022-03-18T00:00:00.000,-73.877136,40.823963,X,AREA OF MINIMAL FLOOD HAZARD,4.0,Soundview-Bruckner-Bronx River
POINT (-74.00355255148285 40.73221474007597),1,Manhattan,102,3,66,27,10,7 Avenue and Bleeker Street,Manhattan,2020-03-11T00:00:00.000,-74.003554,40.732223,X,AREA OF MINIMAL FLOOD HAZARD,5.0,West Village
POINT (-73.92224257450462 40.76727172971333),4,Queens,401,22,36,59,14,30 Avenue and  30 Street,Queens,2019-01-30T00:00:00.000,-73.922244,40.76728,X,AREA OF MINIMAL FLOOD HAZARD,,Astoria (Central)
POINT (-73.94449657152633 40.71521874072835),3,Brooklyn,301,34,50,18,7,Graham Avenue and Conselyea Street,Brooklyn,2025-06-12T00:00:00.000,-73.944498,40.715227,X,AREA OF MINIMAL FLOOD HAZARD,,East Williamsburg
POINT (-73.99858356022342 40.602055765481644),3,Brooklyn,311,43,47,17,11,Benson Avenue and Bay  26th Street,Brooklyn,2020-11-07T00:00:00.000,-73.998585,40.602064,X,AREA OF MINIMAL FLOOD HAZARD,6.0,Bensonhurst
POINT (-74.1591925094699 40.590156772998085),5,Staten Island,502,51,63,24,11,Merry Mount Street and Klondike Avenue,Staten Island,2025-02-24T00:00:00.000,-74.159194,40.590165,X,AREA OF MINIMAL FLOOD HAZARD,,New Springville-Willowbrook-Bulls Head-Travis
POINT (-73.88479659183714 40.68414474512954),3,Brooklyn,305,37,54,18,7,Jamaica Avenue and Linwood Street,Brooklyn,2024-12-18T00:00:00.000,-73.884798,40.684153,X,AREA OF MINIMAL FLOOD HAZARD,,Cypress Hills
POINT (-73.9811325558073 40.779282729766976),1,Manhattan,107,6,67,47,12,Amsterdam Avenue and West  73 Street,Manhattan,2019-11-01T00:00:00.000,-73.981134,40.779291,X,AREA OF MINIMAL FLOOD HAZARD,,Upper West Side-Lincoln Square
POINT (-73.8509136016039 40.71046173853167),4,Queens,406,29,28,15,6,Metropolitan Avenue and  71 Avenue,Queens,2023-07-26T00:00:00.000,-73.850915,40.71047,X,AREA OF MINIMAL FLOOD HAZARD,,Forest Hills
POINT (-73.85463759326889 40.82029471762179),2,Bronx,209,18,87,34,14,Pugsley Avenue and Seward Avenue,Bronx,2021-05-24T00:00:00.000,-73.854639,40.820303,X,AREA OF MINIMAL FLOOD HAZARD,4.0,Soundview-Clason Point
POINT (-73.82686760580252 40.761084727425626),4,Queens,407,20,40,16,6,Union Street and  39 Avenue,Queens,2023-06-20T00:00:00.000,-73.826869,40.761093,X,AREA OF MINIMAL FLOOD HAZARD,,Flushing-Willets Point
POINT (-74.16610650817287 40.57767877530979),5,Staten Island,502,51,63,24,11,Platinum Avenue and 600' West of Marsh Avenue,Staten Island,2025-05-07T00:00:00.000,-74.166108,40.577687,X,AREA OF MINIMAL FLOOD HAZARD,5.0,New Springville-Willowbrook-Bulls Head-Travis
POINT (-73.99091455517483 40.72217374120924),1,Manhattan,103,1,65,27,10,Forsyth Street and Stanton Street,Manhattan,2024-09-27T00:00:00.000,-73.990916,40.722182,X,AREA OF MINIMAL FLOOD HAZARD,,Lower East Side
POINT (-73.9742675607931 40.726101739913844),1,Manhattan,103,2,74,27,10,Avenue D and East  12 Street,Manhattan,2024-01-19T00:00:00.000,-73.974269,40.72611,X,0.2 PCT ANNUAL CHANCE FLOOD HAZARD,1.0,East Village
POINT (-73.91481757360992 40.83598271591721),2,Bronx,204,16,77,32,15,East 169 Street and Sheridan Avenue,Bronx,2025-07-23T00:00:00.000,-73.914819,40.835991,X,AREA OF MINIMAL FLOOD HAZARD,,Concourse-Concourse Village
POINT (-73.96355357092231 40.616204760888486),3,Brooklyn,314,44,48,22,9,Coney Island Avenue and Roder Avenue,Brooklyn,2022-08-18T00:00:00.000,-73.963555,40.616213,X,AREA OF MINIMAL FLOOD HAZARD,,Midwood
POINT (-73.8278636056207 40.76535472722274),4,Queens,407,20,40,16,6,Union Street and  35 Avenue,Queens,2022-08-01T00:00:00.000,-73.827865,40.765363,X,AREA OF MINIMAL FLOOD HAZARD,,Flushing-Willets Point
POINT (-73.9606685629084 40.75735473351584),1,Manhattan,106,4,73,28,12,Sutton Place and East  57 Street,Manhattan,2019-09-01T00:00:00.000,-73.96067,40.757363,X,AREA OF MINIMAL FLOOD HAZARD,,East Midtown-Turtle Bay
POINT (-73.90841057408282 40.85130971321961),2,Bronx,205,14,77,33,15,East Tremont Avenue and Walton Avenue,Bronx,2025-10-16T00:00:00.000,-73.908412,40.851318,X,AREA OF MINIMAL FLOOD HAZARD,,Mount Hope
POINT (-73.79642461683797 40.737822731153564),4,Queens,408,24,25,16,6,Long Island Expressway South Service Road and 173 Street,Queens,2023-12-18T00:00:00.000,-73.796426,40.737831,X,AREA OF MINIMAL FLOOD HAZARD,,Fresh Meadows-Utopia
POINT (-73.93507156704496 40.828235718719355),1,Manhattan,110,9,71,30,13,Harlem River Drive and West 155 Street,Manhattan,2023-11-27T00:00:00.000,-73.935073,40.828244,X,0.2 PCT ANNUAL CHANCE FLOOD HAZARD,3.0,Harlem (North)
POINT (-73.99621855406812 40.713556743322286),1,Manhattan,103,1,65,27,10,East Broadway and Between Catherine Street and Market Street,Manhattan,2016-02-23T00:00:00.000,-73.99622,40.713565,X,AREA OF MINIMAL FLOOD HAZARD,6.0,Chinatown-Two Bridges
POINT (-73.84490759548608 40.84541771236069),2,Bronx,211,18,82,34,14,Eastchester Road and Blondell Avenue,Bronx,2025-10-06T00:00:00.000,-73.844909,40.845426,X,AREA OF MINIMAL FLOOD HAZARD,6.0,Westchester Square
POINT (-73.89468758672021 40.725006737657935),4,Queens,405,30,37,12,6,Long Island Expressway South S/R with 58 Avenue and  69 Street,Queens,2023-11-08T00:00:00.000,-73.894689,40.725015,X,AREA OF MINIMAL FLOOD HAZARD,,Maspeth
POINT (-74.03453654794212 40.61493076404078),3,Brooklyn,310,47,46,26,11,3 Avenue with Marine Avenue and 99 Street (North Leg),Brooklyn,2023-09-01T00:00:00.000,-74.034538,40.614939,X,AREA OF MINIMAL FLOOD HAZARD,,Bay Ridge
POINT (-73.83087060429895 40.767979726336144),4,Queens,407,20,40,16,6,32 Avenue and 137 Street,Queens,2023-10-11T00:00:00.000,-73.830872,40.767988,AE,,3.0,Flushing-Willets Point
POINT (-74.2258624921152 40.529733787214205),5,Staten Island,503,51,62,24,11,Veterans Road West and Bricktown Way,Staten Island,2025-09-19T00:00:00.000,-74.225864,40.529742,X,AREA OF MINIMAL FLOOD HAZARD,,Tottenville-Charleston
POINT (-73.88267758788383 40.76163972966557),4,Queens,403,22,34,13,14,30 Avenue and  86 Street,Queens,2022-09-21T00:00:00.000,-73.882679,40.761648,X,AREA OF MINIMAL FLOOD HAZARD,6.0,East Elmhurst
POINT (-73.99865955178429 40.75524273520844),1,Manhattan,104,3,75,47,12,10 Avenue and West  35 Street,Manhattan,2023-07-07T00:00:00.000,-73.998661,40.755251,X,AREA OF MINIMAL FLOOD HAZARD,,Chelsea-Hudson Yards
POINT (-73.88777458186144 40.837370714822804),2,Bronx,203,15,79,32,15,Boston Road with Southern Boulevard and East 174 Street,Bronx,2023-06-10T00:00:00.000,-73.887776,40.837379,X,AREA OF MINIMAL FLOOD HAZARD,,Crotona Park East
POINT (-73.89098657899962 40.87175670866862),2,Bronx,207,14,78,33,13,Jerome Avenue and Minerva Place,Bronx,2024-11-08T00:00:00.000,-73.890988,40.871765,X,AREA OF MINIMAL FLOOD HAZARD,,Bedford Park
POINT (-73.85775159594559 40.758017729109866),4,Queens,403,21,35,13,14,Northern Boulevard and 112 Street,Queens,2018-11-06T00:00:00.000,-73.857753,40.758026,X,AREA OF MINIMAL FLOOD HAZARD,,North Corona
POINT (-73.90024957793281 40.83118771704549),2,Bronx,203,17,79,32,15,Boston Road and East 169 Street,Bronx,2023-08-04T00:00:00.000,-73.900251,40.831196,X,AREA OF MINIMAL FLOOD HAZARD,,Morrisania
POINT (-73.88989334997781 40.820914633150565),2,Bronx,202,17,85,32,14,Bruckner Boulevard Southbound and 200' N of Hunts Point Avenue,Bronx,2025-06-06T00:00:00.000,-73.8898947682,40.8209229155,X,AREA OF MINIMAL FLOOD HAZARD,,Hunts Point
POINT (-73.94654139338816 40.74546233110316),4,Queens,402,26,37,59,7,Jackson Avenue and Crane Street,Queens,2025-10-17T00:00:00.000,-73.9465428253,40.7454705957,X,AREA OF MINIMAL FLOOD HAZARD,2.0,Long Island City-Hunters Point
POINT (-73.88210658949473 40.73486573458821),4,Queens,404,30,30,12,6,"Grand Avenue with Van Kleeck Street, Kneeland Avenue, and Haspel Street",Queens,2022-05-06T00:00:00.000,-73.882108,40.734874,X,AREA OF MINIMAL FLOOD HAZARD,,Elmhurst
POINT (-73.91148857397965 40.84732671370638),2,Bronx,205,14,77,33,15,East 175 Street and Townsend Avenue,Bronx,2019-09-17T00:00:00.000,-73.91149,40.847335,X,AREA OF MINIMAL FLOOD HAZARD,,Mount Hope
POINT (-73.98116355478913 40.78434672887851),1,Manhattan,107,6,67,47,12,West End Avenue and West  79 Street,Manhattan,2020-02-24T00:00:00.000,-73.981165,40.784355,X,AREA OF MINIMAL FLOOD HAZARD,,Upper West Side (Central)
POINT (-73.87730558941516 40.763337729249855),4,Queens,403,22,35,13,14,Astoria Boulevard and  92 Street,Queens,2023-05-04T00:00:00.000,-73.877307,40.763346,X,AREA OF MINIMAL FLOOD HAZARD,6.0,East Elmhurst
POINT (-73.9639005590323 40.80799672373791),1,Manhattan,109,7,69,30,13,Broadway and West 116 Street,Manhattan,2023-12-12T00:00:00.000,-73.963902,40.808005,X,AREA OF MINIMAL FLOOD HAZARD,,Morningside Heights
POINT (-74.1326195153814 40.635005763211396),5,Staten Island,501,49,61,23,11,Castleton Avenue and Heberton Avenue,Staten Island,2023-03-08T00:00:00.000,-74.132621,40.635014,X,AREA OF MINIMAL FLOOD HAZARD,5.0,Port Richmond
POINT (-73.77816461993423 40.7814007222604),4,Queens,407,19,26,11,3,23 Avenue with 212 Street and 213 Place,Queens,2024-05-02T00:00:00.000,-73.778166,40.781409,X,AREA OF MINIMAL FLOOD HAZARD,5.0,Bay Terrace-Clearview
POINT (-73.95303457458206 40.61359676093888),3,Brooklyn,314,48,41,22,9,Avenue O and East 21 Street,Brooklyn,2024-02-09T00:00:00.000,-73.953036,40.613605,X,AREA OF MINIMAL FLOOD HAZARD,5.0,Midwood
POINT (-73.77676962406939 40.72172773373197),4,Queens,408,24,24,11,5,Grand Central Parkway Eastbound Service Road with McLaughlin Avenue and 188 Street,Queens,2021-12-15T00:00:00.000,-73.776771,40.721736,X,AREA OF MINIMAL FLOOD HAZARD,,Jamaica Estates-Holliswood
POINT (-73.98443955759744 40.73302573898549),1,Manhattan,106,2,74,59,12,2 Avenue and East  15 Street,Manhattan,2024-03-04T00:00:00.000,-73.984441,40.733034,X,AREA OF MINIMAL FLOOD HAZARD,5.0,Gramercy
POINT (-73.89595729894286 40.73352353493106),4,Queens,405,30,30,12,6,69 Street and 52 Avenue,Queens,2024-03-25T00:00:00.000,-73.8959587125,40.7335317993,X,AREA OF MINIMAL FLOOD HAZARD,,Maspeth
POINT (-73.90069357643824 40.85024471338149),2,Bronx,205,15,86,32,15,East Burnside Avenue and Valentine Avenue,Bronx,2025-10-28T00:00:00.000,-73.900695,40.850253,X,AREA OF MINIMAL FLOOD HAZARD,,Mount Hope
POINT (-73.92787258224172 40.6144767605747),3,Brooklyn,318,46,59,21,8,Flatbush Avenue and Fillmore Avenue,Brooklyn,2024-07-31T00:00:00.000,-73.927874,40.614485,X,AREA OF MINIMAL FLOOD HAZARD,3.0,Flatlands
POINT (-73.8074396179395 40.67488774403642),4,Queens,410,28,31,10,5,"Rockaway Boulevard, Lincoln Street, and 131 Street",Queens,2021-04-09T00:00:00.000,-73.807441,40.674896,X,AREA OF MINIMAL FLOOD HAZARD,6.0,South Ozone Park
POINT (-73.99328955405105 40.74222373770148),1,Manhattan,105,3,75,28,12,6 Avenue and West  22 Street,Manhattan,2025-07-09T00:00:00.000,-73.993291,40.742232,X,AREA OF MINIMAL FLOOD HAZARD,,Midtown South-Flatiron-Union Square
POINT (-74.16422951088848 40.543293782507014),5,Staten Island,503,51,62,24,11,Richmond Avenue and Amboy Road,Staten Island,2023-05-11T00:00:00.000,-74.164231,40.543302,X,AREA OF MINIMAL FLOOD HAZARD,,Great Kills-Eltingville
POINT (-73.82662260982825 40.70466673860006),4,Queens,409,29,28,14,5,Metropolitan Avenue and 125 Street (East Leg),Queens,2025-03-28T00:00:00.000,-73.826624,40.704675,X,AREA OF MINIMAL FLOOD HAZARD,,Kew Gardens
POINT (-74.1180045198723 40.640552761297535),5,Staten Island,501,49,61,23,11,Richmond Terrace and Broadway,Staten Island,2025-06-16T00:00:00.000,-74.118006,40.640561,AE,,2.0,Port Richmond
POINT (-73.91970558101949 40.67174974897801),3,Brooklyn,316,41,55,25,9,Howard Avenue and Park Place,Brooklyn,2025-03-03T00:00:00.000,-73.919707,40.671758,X,AREA OF MINIMAL FLOOD HAZARD,,Ocean Hill
POINT (-74.10455852486436 40.63469776276887),5,Staten Island,501,49,63,23,11,Castleton Avenue and Kissel Avenue,Staten Island,2025-02-12T00:00:00.000,-74.10456,40.634706,X,AREA OF MINIMAL FLOOD HAZARD,,West New Brighton-Silver Lake-Grymes Hill
POINT (-73.8883500123801 40.82194304996644),2,Bronx,202,17,85,32,14,Bruckner Boulevard S/B and Bryant Avenue,Bronx,2024-12-05T00:00:00.000,-73.8883514298,40.8219513319,X,AREA OF MINIMAL FLOOD HAZARD,,Hunts Point
POINT (-73.89325758703431 40.72718473703393),4,Queens,405,30,30,12,6,Grand Avenue and  69 Lane (East Leg),Queens,2023-09-20T00:00:00.000,-73.893259,40.727193,X,AREA OF MINIMAL FLOOD HAZARD,,Maspeth
POINT (-73.83390259701252 40.87515170616985),2,Bronx,210,12,82,36,16,Baychester Avenue and 200' South of Donzetti Place,Bronx,2018-12-26T00:00:00.000,-73.833904,40.87516,X,AREA OF MINIMAL FLOOD HAZARD,6.0,Co-op City
POINT (-73.98474855708315 40.73949773748337),1,Manhattan,105,2,74,59,12,Lexington Avenue and East  23 Street,Manhattan,2022-06-04T00:00:00.000,-73.98475,40.739506,X,AREA OF MINIMAL FLOOD HAZARD,5.0,Gramercy
POINT (-73.88874058213209 40.83569771520778),2,Bronx,203,17,79,32,15,Southern Boulevard and East 173 Street,Bronx,2023-04-05T00:00:00.000,-73.888742,40.835706,X,AREA OF MINIMAL FLOOD HAZARD,,Crotona Park East
POINT (-73.86035859085317 40.833319714714875),2,Bronx,209,18,87,34,14,Hugh Grant Circle and Westchester Avenue (East),Bronx,2022-09-02T00:00:00.000,-73.86036,40.833328,X,AREA OF MINIMAL FLOOD HAZARD,5.0,Parkchester
POINT (-73.99613355174705 40.767282732977925),1,Manhattan,104,3,67,47,12,12 Avenue and West  51 Street.,Manhattan,2023-06-01T00:00:00.000,-73.996135,40.767291,X,AREA OF MINIMAL FLOOD HAZARD,3.0,Hell's Kitchen
POINT (-73.97382456437444 40.66821475151906),3,Brooklyn,306,39,44,20,10,Prospect Park West with 3 Street and Prospect Park Entrance,Brooklyn,2022-07-22T00:00:00.000,-73.973826,40.668223,X,AREA OF MINIMAL FLOOD HAZARD,,Prospect Park
POINT (-73.90247658073072 40.77032572915484),4,Queens,401,22,34,11,14,Ditmars Boulevard and  46 Street,Queens,2024-10-03T00:00:00.000,-73.902478,40.770334,X,AREA OF MINIMAL FLOOD HAZARD,,Astoria (North)-Ditmars-Steinway
POINT (-73.92065658058527 40.690919745046926),3,Brooklyn,304,37,54,18,7,Bushwick Avenue and Gates Avenue,Brooklyn,2024-10-29T00:00:00.000,-73.920658,40.690928,X,AREA OF MINIMAL FLOOD HAZARD,,Bushwick (East)
POINT (-73.97299456851782 40.60880576315892),3,Brooklyn,311,44,47,17,9,Avenue P and McDonald Avenue,Brooklyn,2025-10-30T00:00:00.000,-73.972996,40.608814,X,AREA OF MINIMAL FLOOD HAZARD,6.0,Gravesend (West)
POINT (-73.91875758421148 40.62408075790816),3,Brooklyn,318,46,59,21,8,Avenue L and East  59 Street,Brooklyn,2022-09-30T00:00:00.000,-73.918759,40.624089,X,AREA OF MINIMAL FLOOD HAZARD,3.0,Flatlands
POINT (-73.96791356823522 40.639653757063854),3,Brooklyn,314,40,44,21,9,Cortelyou Road and Stratford Road,Brooklyn,2020-06-23T00:00:00.000,-73.967915,40.639662,X,AREA OF MINIMAL FLOOD HAZARD,,Flatbush (West)-Ditmas Park-Parkville
POINT (-73.73452664112693 40.664346743619),4,Queens,413,31,29,10,5,Francis Lewis Boulevard and 246 Street,Queens,2025-09-18T00:00:00.000,-73.734528,40.664355,X,AREA OF MINIMAL FLOOD HAZARD,5.0,Rosedale
POINT (-73.8934235795386 40.85139571238688),2,Bronx,206,15,86,32,15,3 Avenue and East 181 Street,Bronx,2024-02-06T00:00:00.000,-73.893425,40.851404,X,AREA OF MINIMAL FLOOD HAZARD,,Tremont
POINT (-73.93466856696926 40.842948715519306),1,Manhattan,112,10,72,31,13,Amsterdam Avenue and West 173 Street,Manhattan,2022-07-26T00:00:00.000,-73.93467,40.842957,X,AREA OF MINIMAL FLOOD HAZARD,,Highbridge Park
POINT (-73.82876059863874 40.8694467070066),2,Bronx,210,12,82,36,16,Bartow Avenue and Between Co-op City and Asch Loop,Bronx,2025-08-27T00:00:00.000,-73.828762,40.869455,X,0.2 PCT ANNUAL CHANCE FLOOD HAZARD,4.0,Co-op City
POINT (-73.80971061574662 40.69219874078607),4,Queens,412,28,32,10,5,Liberty Avenue and Remington Street,Queens,2023-12-26T00:00:00.000,-73.809712,40.692207,X,AREA OF MINIMAL FLOOD HAZARD,,South Jamaica
POINT (-73.81175761564437 40.67527974380292),4,Queens,410,28,31,10,5,Rockaway Boulevard and 126 Street,Queens,2020-01-05T00:00:00.000,-73.811759,40.675288,X,AREA OF MINIMAL FLOOD HAZARD,6.0,South Ozone Park
POINT (-73.90157858435457 40.716131739507496),4,Queens,405,30,37,12,6,Fresh Pond Road and  60 Road,Queens,2021-09-23T00:00:00.000,-73.90158,40.71614,X,AREA OF MINIMAL FLOOD HAZARD,,Maspeth
POINT (-73.97409156662938 40.63594875714052),3,Brooklyn,312,40,44,21,9,Ditmas Avenue and East   5 Street,Brooklyn,2012-12-12T00:00:00.000,-73.974093,40.635957,X,AREA OF MINIMAL FLOOD HAZARD,,Kensington
POINT (-73.91379558454679 40.684791618203974),3,Brooklyn,"304, 316",41,55,25,8,Broadway and Covert Street,Brooklyn,2024-04-24T00:00:00.000,-73.9137970017,40.6847998716,X,AREA OF MINIMAL FLOOD HAZARD,,Ocean Hill
POINT (-73.9192245730283 40.80755072201855),2,Bronx,201,8,84,29,14,East 138 Street and Brook Avenue,Bronx,2023-09-22T00:00:00.000,-73.919226,40.807559,X,AREA OF MINIMAL FLOOD HAZARD,5.0,Mott Haven-Port Morris
POINT (-73.74078764000306 40.663384744063144),4,Queens,413,31,31,10,5,143 Avenue and Brookville Boulevard,Queens,2022-11-03T00:00:00.000,-73.740789,40.663393,X,AREA OF MINIMAL FLOOD HAZARD,5.0,Rosedale
POINT (-73.9210645818463 40.657166751872914),3,Brooklyn,317,41,58,19,9,Kings Highway and East  93 Street,Brooklyn,2022-10-13T00:00:00.000,-73.921066,40.657175,X,AREA OF MINIMAL FLOOD HAZARD,6.0,East Flatbush-Remsen Village
POINT (-73.982655558234 40.72725274016313),1,Manhattan,103,2,74,27,10,Avenue A and East  9 Street,Manhattan,2023-11-16T00:00:00.000,-73.982657,40.727261,X,AREA OF MINIMAL FLOOD HAZARD,4.0,East Village
POINT (-73.78100862044778 40.76716472496346),4,Queens,411,19,26,16,3,35 Avenue and Clearview Expwy East S/R,Queens,2023-08-17T00:00:00.000,-73.78101,40.767173,X,AREA OF MINIMAL FLOOD HAZARD,,Bayside
POINT (-73.9254826746868 40.75213073344889),4,Queens,401,26,36,12,7,Northern Boulevard and  38 Street,Queens,2024-08-23T00:00:00.000,-73.9254841,40.752139,X,AREA OF MINIMAL FLOOD HAZARD,5.0,Sunnyside Yards (North)
POINT (-73.8236726004274 40.86910770628654),2,Bronx,210,12,82,36,16,Bartow Avenue and Bay Plaza,Bronx,2025-08-14T00:00:00.000,-73.823674,40.869116,X,0.2 PCT ANNUAL CHANCE FLOOD HAZARD,4.0,Co-op City
POINT (-73.86051258767377 40.87548670647257),2,Bronx,212,12,83,36,15,East Gun Hill Road and Bronxwood Avenue,Bronx,2024-01-11T00:00:00.000,-73.860514,40.875495,X,AREA OF MINIMAL FLOOD HAZARD,,Williamsbridge-Olinville
POINT (-73.92921857009307 40.819049719867884),2,Bronx,201,17,84,29,15,East 149 Street and Gerard Avenue,Bronx,2025-05-14T00:00:00.000,-73.92922,40.819058,X,AREA OF MINIMAL FLOOD HAZARD,5.0,Concourse-Concourse Village
POINT (-73.83838360704016 40.679785744367884),4,Queens,410,28,23,10,5,Rockaway Boulevard and 101 Street,Queens,2024-02-16T00:00:00.000,-73.838385,40.679794,X,AREA OF MINIMAL FLOOD HAZARD,,South Ozone Park
POINT (-73.81255861514306 40.680991743350226),4,Queens,410,28,31,10,5,Linden Boulevard and 128th Street,Queens,2021-01-07T00:00:00.000,-73.81256,40.681,X,AREA OF MINIMAL FLOOD HAZARD,,South Ozone Park
POINT (-73.90399257493385 40.86423971014814),2,Bronx,207,14,78,31,13,University Avenue with West 188 Street and Father Zeiser Place,Bronx,2023-03-13T00:00:00.000,-73.903994,40.864248,X,AREA OF MINIMAL FLOOD HAZARD,,University Heights (North)-Fordham
POINT (-73.78212762263567 40.731239732404305),4,Queens,408,23,25,16,6,188 Street and 75 Avenue,Queens,2023-06-12T00:00:00.000,-73.782129,40.731248,X,AREA OF MINIMAL FLOOD HAZARD,,Fresh Meadows-Utopia
POINT (-73.99537242213339 40.69051170297967),3,Brooklyn,"302, 306",39,52,26,10,Atlantic Avenue between Henry Street and Clinton Street,Brooklyn,2024-11-02T00:00:00.000,-73.9953738661,40.6905199553,X,AREA OF MINIMAL FLOOD HAZARD,,Carroll Gardens-Cobble Hill-Gowanus-Red Hook
POINT (-73.85192060232687 40.69301274194698),4,Queens,409,32,38,15,7,Woodhaven Boulevard West S/R and 147' South of Jamaica Avenue,Queens,2018-10-23T00:00:00.000,-73.851922,40.693021,X,AREA OF MINIMAL FLOOD HAZARD,,Woodhaven
POINT (-74.11262052655093 40.56762277594949),5,Staten Island,502,50,64,24,11,Hylan Boulevard and Beach Avenue,Staten Island,2023-08-03T00:00:00.000,-74.112622,40.567631,X,AREA OF MINIMAL FLOOD HAZARD,5.0,New Dorp-Midland Beach
POINT (-73.99250355617706 40.70238774478708),3,Brooklyn,302,33,52,26,10,Front Street and Dock Street,Brooklyn,2023-07-18T00:00:00.000,-73.992505,40.702396,X,AREA OF MINIMAL FLOOD HAZARD,4.0,Downtown Brooklyn-DUMBO-Boerum Hill
POINT (-73.90338857478174 40.87686970800485),2,Bronx,208,14,81,31,13,Bailey Avenue and Albany Crescent,Bronx,2025-07-21T00:00:00.000,-73.90339,40.876878,X,AREA OF MINIMAL FLOOD HAZARD,6.0,Kingsbridge Heights-Van Cortlandt Village
POINT (-73.92495457440904 40.754336732660754),4,Queens,401,26,36,59,7,36 Avenue and  37 Street,Queens,2022-08-16T00:00:00.000,-73.924956,40.754345,X,AREA OF MINIMAL FLOOD HAZARD,,Queensbridge-Ravenswood-Dutch Kills
POINT (-74.16757151003543 40.550565781172665),5,Staten Island,503,51,62,24,11,Richmond Avenue and Katan Avenue,Staten Island,2024-07-02T00:00:00.000,-74.167573,40.550574,AE,FLOODWAY,,Great Kills-Eltingville
POINT (-73.98708755558259 40.753597735162806),1,Manhattan,105,4,75,28,12,Broadway and West  39 Street,Manhattan,2024-03-11T00:00:00.000,-73.987089,40.753606,X,AREA OF MINIMAL FLOOD HAZARD,,Midtown-Times Square
POINT (-73.86817758406576 40.90239070179398),2,Bronx,226,11,81,36,15,Van Cortlandt Park East with Katonah Avenue and East 242 Street,Bronx,2023-10-06T00:00:00.000,-73.868179,40.902399,X,AREA OF MINIMAL FLOOD HAZARD,,Wakefield-Woodlawn
POINT (-73.89902758360736 40.74603973345243),4,Queens,402,26,30,12,6,Roosevelt Avenue with 65 Street and 65 Place,Queens,2025-03-31T00:00:00.000,-73.899029,40.746048,X,AREA OF MINIMAL FLOOD HAZARD,,Woodside
POINT (-73.88800758878344 40.730044736423615),4,Queens,405,30,30,12,6,Grand Avenue and  74 Street,Queens,2020-10-15T00:00:00.000,-73.888009,40.730053,X,AREA OF MINIMAL FLOOD HAZARD,,Maspeth
POINT (-73.95714157204038 40.62320075932344),3,Brooklyn,314,44,48,22,9,Avenue K and East  19 Street,Brooklyn,2025-10-17T00:00:00.000,-73.957143,40.623209,X,AREA OF MINIMAL FLOOD HAZARD,,Midwood
POINT (-74.07095353622584 40.62042276403174),5,Staten Island,501,49,63,23,11,Bay Street and Front Street,Staten Island,2022-06-13T00:00:00.000,-74.070955,40.620431,X,0.2 PCT ANNUAL CHANCE FLOOD HAZARD,2.0,Rosebank-Shore Acres-Park Hill
POINT (-73.8618534564233 40.74158087508379),4,Queens,404,21,35,13,6,99 Street and Christie Avenue,Queens,2024-11-07T00:00:00.000,-73.86185486,40.7415891416,X,AREA OF MINIMAL FLOOD HAZARD,6.0,Corona
POINT (-73.89647057907388 40.833039716126116),2,Bronx,203,17,79,32,15,Prospect Avenue and East 170 Street,Bronx,2024-01-17T00:00:00.000,-73.896472,40.833048,X,AREA OF MINIMAL FLOOD HAZARD,,Crotona Park East
POINT (-73.97995855788497 40.74319673694565),1,Manhattan,106,2,74,59,12,3 Avenue and East  30 Street,Manhattan,2024-09-16T00:00:00.000,-73.97996,40.743205,X,AREA OF MINIMAL FLOOD HAZARD,,Murray Hill-Kips Bay
POINT (-73.91194857375979 40.8431967147595),2,Bronx,204,16,77,32,15,Grand Concourse and Mount Eden Avenue East,Bronx,2023-03-07T00:00:00.000,-73.91195,40.843205,X,AREA OF MINIMAL FLOOD HAZARD,,Mount Eden-Claremont (West)
POINT (-73.9181145765148 40.770021729154855),4,Queens,401,22,36,59,14,Astoria Boulevard and  31 Street,Queens,2023-09-01T00:00:00.000,-73.918116,40.77003,X,AREA OF MINIMAL FLOOD HAZARD,,Astoria (Central)
POINT (-73.932606572728 40.744773734692345),4,Queens,402,26,37,12,7,Queens Boulevard and  32 Place,Queens,2020-07-21T00:00:00.000,-73.932608,40.744782,X,AREA OF MINIMAL FLOOD HAZARD,,Sunnyside
POINT (-73.88744358221847 40.822758717492796),2,Bronx,202,17,85,32,14,Whitlock Avenue with Longfellow Avenue and Bruckner Boulevard,Bronx,2023-06-28T00:00:00.000,-73.887445,40.822767,X,AREA OF MINIMAL FLOOD HAZARD,,Longwood
POINT (-74.16618592926359 40.63584564732139),5,Staten Island,501,49,63,23,11,South Avenue and Arlington Place,Staten Island,2025-05-16T00:00:00.000,-74.1661874238,40.6358538831,X,AREA OF MINIMAL FLOOD HAZARD,,Mariner's Harbor-Arlington-Graniteville
POINT (-74.0007025518946 40.74224673729045),1,Manhattan,104,3,75,47,12,8 Avenue and West  18 Street,Manhattan,2022-02-28T00:00:00.000,-74.000704,40.742255,X,AREA OF MINIMAL FLOOD HAZARD,5.0,Chelsea-Hudson Yards
POINT (-73.92113958369927 40.6388747551098),3,Brooklyn,318,45,58,21,9,Foster Avenue and East 58 Street,Brooklyn,2023-05-18T00:00:00.000,-73.921141,40.638883,X,AREA OF MINIMAL FLOOD HAZARD,4.0,Flatlands
POINT (-73.9256665686039 40.861249711944744),1,Manhattan,112,10,72,31,13,Nagle Avenue and Thayler Street,Manhattan,2024-01-05T00:00:00.000,-73.925668,40.861258,X,AREA OF MINIMAL FLOOD HAZARD,4.0,Washington Heights (North)
POINT (-73.91573858545364 40.63649275581397),3,Brooklyn,318,45,59,19,8,Glenwood Road and East  79 Street,Brooklyn,2020-04-23T00:00:00.000,-73.91574,40.636501,X,AREA OF MINIMAL FLOOD HAZARD,3.0,Canarsie
POINT (-73.99536876035552 40.61398698995519),3,Brooklyn,311,43,49,17,11,18 Avenue and 74 Street,Brooklyn,2024-03-04T00:00:00.000,-73.9953702003,40.6139952271,X,AREA OF MINIMAL FLOOD HAZARD,,Bensonhurst
POINT (-73.90468257469935 40.85705171225211),2,Bronx,205,14,86,33,13,Jerome Avenue and West 182 Street,Bronx,2025-03-03T00:00:00.000,-73.904684,40.85706,X,AREA OF MINIMAL FLOOD HAZARD,,Fordham Heights
POINT (-73.95745656589168 40.72227474024308),3,Brooklyn,301,33,50,59,7,Wythe Avenue and North 12 Street,Brooklyn,2022-07-27T00:00:00.000,-73.957458,40.722283,X,AREA OF MINIMAL FLOOD HAZARD,5.0,Williamsburg
