the_geom,borocode,boroname,borocd,coundist,assemdist,stsendist,congdist,location,borough,date_insta,point_x,point_y,femafldz,femafldt,hrcevac,ntaname
POINT (-73.85323460117405 40.69325474176756),4,Queens,409,32,38,15,7,Jamaica Avenue and  92 Street,Queens,2024-08-30T00:00:00.000,-73.853236,40.693263,X,AREA OF MINIMAL FLOOD HAZARD,,Woodhaven
POINT (-73.95414357538135 40.58309776684489),3,Brooklyn,315,48,45,23,8,Neptune Avenue with Emmons Avenue and Shore Boulevard,Brooklyn,2018-06-23T00:00:00.000,-73.954145,40.583106,AE,,1.0,Brighton Beach
POINT (-73.82518360630122 40.75764072840589),4,Queens,407,20,40,16,6,Sanford Avenue and Union Street,Queens,2023-04-28T00:00:00.000,-73.825185,40.757649,X,AREA OF MINIMAL FLOOD HAZARD,,Flushing-Willets Point
POINT (-73.74356963824107 40.65967974469477),4,Queens,413,31,31,10,5,Brookville Boulevard and Newhall Avenue,Queens,2022-04-27T00:00:00.000,-73.743571,40.659688,X,AREA OF MINIMAL FLOOD HAZARD,1.0,Springfield Gardens (South)-Brookville
POINT (-74.12489652271633 40.56894177633572),5,Staten Island,503,50,62,24,11,Amboy Road and Tysens Lane,Staten Island,2023-04-13T00:00:00.000,-74.124898,40.56895,X,AREA OF MINIMAL FLOOD HAZARD,,Oakwood-Richmondtown
POINT (-73.9781515648211 40.6302737590294),3,Brooklyn,312,44,48,22,9,18 Avenue with Dahill Road and 45 Street,Brooklyn,2025-11-24T00:00:00.000,-73.978153,40.630282,X,AREA OF MINIMAL FLOOD HAZARD,,Borough Park
POINT (-73.94454257363681 40.67399774864792),3,Brooklyn,308,36,43,20,9,Brooklyn Avenue and Prospect Place,Brooklyn,2024-08-12T00:00:00.000,-73.944544,40.674006,X,AREA OF MINIMAL FLOOD HAZARD,,Crown Heights (North)
POINT (-73.8748045819698 40.89571770283609),2,Bronx,212,11,81,33,15,East 233 Street and Napier Avenue,Bronx,2024-11-21T00:00:00.000,-73.874806,40.895726,X,AREA OF MINIMAL FLOOD HAZARD,,Woodlawn Cemetery
POINT (-74.07546553349599 40.63518676154044),5,Staten Island,501,49,61,23,11,Bay Street with Swan Street and Van Duzer Street Extension,Staten Island,2023-09-13T00:00:00.000,-74.075467,40.635195,X,AREA OF MINIMAL FLOOD HAZARD,2.0,Tompkinsville-Stapleton-Clifton-Fox Hills
POINT (-73.9933125847995 40.689943277026494),3,Brooklyn,"302, 306",39,52,26,10,Atlantic Avenue between Clinton Street and Court Street,Brooklyn,2024-10-29T00:00:00.000,-73.9933140285,40.6899515294,X,AREA OF MINIMAL FLOOD HAZARD,,Carroll Gardens-Cobble Hill-Gowanus-Red Hook
POINT (-74.16485351162389 40.52789978539607),5,Staten Island,503,51,62,24,11,Hylan Boulevard and Holdridge Avenue,Staten Island,2025-06-19T00:00:00.000,-74.164855,40.527908,X,AREA OF MINIMAL FLOOD HAZARD,5.0,Annadale-Huguenot-Prince's Bay-Woodrow
POINT (-73.96778755834687 40.80632972405156),1,Manhattan,109,7,69,30,12,Riverside Drive and West 112 Street (mid-block),Manhattan,2018-05-17T00:00:00.000,-73.967789,40.806338,X,AREA OF MINIMAL FLOOD HAZARD,,Morningside Heights
POINT (-73.91384558272168 40.67489974738908),3,Brooklyn,316,41,55,25,8,Thomas Boyland Street and Dean Street,Brooklyn,2024-12-26T00:00:00.000,-73.913847,40.674908,X,AREA OF MINIMAL FLOOD HAZARD,,Ocean Hill
POINT (-74.0849145554346 40.61815016694757),5,Staten Island,501,49,61,23,11,Targee Street and Waverly Place,Staten Island,2024-09-22T00:00:00.000,-74.0849160242,40.618158402,X,AREA OF MINIMAL FLOOD HAZARD,,Tompkinsville-Stapleton-Clifton-Fox Hills
POINT (-73.86499959493 40.74467373259392),4,Queens,404,21,39,13,6,Corona Avenue and 98 Street,Queens,2022-07-18T00:00:00.000,-73.865001,40.744682,X,AREA OF MINIMAL FLOOD HAZARD,6.0,Corona
POINT (-73.95106057715456 40.5860067662067),3,Brooklyn,315,48,45,23,8,Voorhies Avenue and East  18 Street,Brooklyn,2017-04-04T00:00:00.000,-73.951062,40.586015,AE,,1.0,Sheepshead Bay-Manhattan Beach-Gerritsen Beach
POINT (-73.947068565874 40.78422872783281),1,Manhattan,111,8,68,29,12,2 Avenue and East  96 Street,Manhattan,2019-08-24T00:00:00.000,-73.94707,40.784237,X,AREA OF MINIMAL FLOOD HAZARD,2.0,Upper East Side-Yorkville
POINT (-73.99442455312015 40.7526357357299),1,Manhattan,104,3,75,47,12,West  34 Street between 8 Avenue and 9 Avenue,Manhattan,2012-02-07T00:00:00.000,-73.994426,40.752644,X,AREA OF MINIMAL FLOOD HAZARD,,Chelsea-Hudson Yards
POINT (-74.10690852365296 40.63046176327507),5,Staten Island,501,49,63,24,11,Forest Avenue and North Mada Avenue,Staten Island,2021-10-18T00:00:00.000,-74.10691,40.63047,X,AREA OF MINIMAL FLOOD HAZARD,,West New Brighton-Silver Lake-Grymes Hill
POINT (-73.93665456651853 40.830007718139655),1,Manhattan,110,9,71,30,13,8 Avenue and West 156 Street,Manhattan,2017-05-22T00:00:00.000,-73.936656,40.830016,X,AREA OF MINIMAL FLOOD HAZARD,3.0,Harlem (North)
POINT (-73.77594162273786 40.74381072949778),4,Queens,411,20,25,16,6,Long Island Expressway North S/R and Francis Lewis Boulevard,Queens,2025-10-31T00:00:00.000,-73.775943,40.743819,X,AREA OF MINIMAL FLOOD HAZARD,,Auburndale
POINT (-73.9848295599259 40.68692174777813),3,Brooklyn,302,33,52,26,10,Atlantic Avenue and Bond Street,Brooklyn,2013-11-26T00:00:00.000,-73.984831,40.68693,X,AREA OF MINIMAL FLOOD HAZARD,,Downtown Brooklyn-DUMBO-Boerum Hill
POINT (-73.85158259172233 40.85747870946701),2,Bronx,211,13,80,34,15,Pelham Parkway South E/B and Narragansett Avenue,Bronx,2019-02-27T00:00:00.000,-73.851584,40.857487,X,AREA OF MINIMAL FLOOD HAZARD,,Morris Park
POINT (-74.07571153341135 40.64138576022515),5,Staten Island,501,49,61,23,11,Bay Street and Stuyvesant Place,Staten Island,2025-04-21T00:00:00.000,-74.075713,40.641394,X,AREA OF MINIMAL FLOOD HAZARD,,St. George-New Brighton
POINT (-73.84458959428606 40.86983970759459),2,Bronx,212,12,83,36,15,East Gun Hill Road with Knapp Street and Morgan Avenue,Bronx,2025-05-22T00:00:00.000,-73.844591,40.869848,X,AREA OF MINIMAL FLOOD HAZARD,,Eastchester-Edenwald-Baychester
POINT (-73.82862560467257 40.77069972649913),4,Queens,407,20,40,16,6,31 Road and 140 Street,Queens,2025-04-25T00:00:00.000,-73.828627,40.770708,X,AREA OF MINIMAL FLOOD HAZARD,4.0,Flushing-Willets Point
POINT (-73.82837960778386 40.71320973751951),4,Queens,409,29,28,14,5,Queens Boulevard and Queens Borough Hall,Queens,2015-10-31T00:00:00.000,-73.828381,40.713218,X,AREA OF MINIMAL FLOOD HAZARD,,Kew Gardens
POINT (-73.97435556530407 40.64494675593451),3,Brooklyn,312,39,44,20,9,Ocean Parkway and Church Avenue,Brooklyn,2019-11-15T00:00:00.000,-73.974357,40.644955,X,AREA OF MINIMAL FLOOD HAZARD,,Kensington
POINT (-73.86466658614866 40.88058070613154),2,Bronx,212,12,83,36,15,White Plains Road and East 215 Street,Bronx,2021-12-02T00:00:00.000,-73.864668,40.880589,X,AREA OF MINIMAL FLOOD HAZARD,,Williamsbridge-Olinville
POINT (-73.87886058956506 40.75623273088523),4,Queens,403,25,34,13,14,Northern Boulevard and  89 Street,Queens,2019-08-05T00:00:00.000,-73.878862,40.756241,X,AREA OF MINIMAL FLOOD HAZARD,,Jackson Heights
POINT (-74.20798049759411 40.5416997844172),5,Staten Island,503,51,62,24,11,Woodrow Road and Rossville Avenue,Staten Island,2025-06-24T00:00:00.000,-74.207982,40.541708,X,AREA OF MINIMAL FLOOD HAZARD,,Arden Heights-Rossville
POINT (-73.92646657496623 40.75206273278356),4,Queens,401,26,36,12,7,Northern Boulevard and  37 Street,Queens,2024-08-06T00:00:00.000,-73.926468,40.752071,X,AREA OF MINIMAL FLOOD HAZARD,5.0,Sunnyside Yards (North)
POINT (-73.88346058027206 40.88077370664473),2,Bronx,207,11,80,33,15,Jerome Avenue and East 208 Street,Bronx,2025-01-24T00:00:00.000,-73.883462,40.880782,X,AREA OF MINIMAL FLOOD HAZARD,,Norwood
POINT (-74.08792353159826 40.60870476703957),5,Staten Island,501,49,63,23,11,Targee Street with Narrows Road North and Dekalb Street,Staten Island,2023-11-02T00:00:00.000,-74.087925,40.608713,X,AREA OF MINIMAL FLOOD HAZARD,,Rosebank-Shore Acres-Park Hill
POINT (-73.88382557998578 40.88046470672873),2,Bronx,207,11,80,33,15,Jerome Avenue and Mosholu Parkway North S/R,Bronx,2025-01-24T00:00:00.000,-73.883827,40.880473,X,AREA OF MINIMAL FLOOD HAZARD,,Norwood
POINT (-73.8625535912213 40.82370371698531),2,Bronx,209,18,85,34,14,Story Avenue and Thieriot Avenue,Bronx,2020-09-02T00:00:00.000,-73.862555,40.823712,X,AREA OF MINIMAL FLOOD HAZARD,4.0,Soundview-Clason Point
POINT (-73.90755157451352 40.8478127137975),2,Bronx,205,14,86,33,15,Grand Concourse with Weeks Avenue and East 176 Street,Bronx,2024-02-07T00:00:00.000,-73.907553,40.847821,X,AREA OF MINIMAL FLOOD HAZARD,,Mount Hope
POINT (-73.8562265890264 40.88315270527218),2,Bronx,212,12,83,36,15,Bronxwood Avenue and East 221 Street,Bronx,2017-10-11T00:00:00.000,-73.856228,40.883161,X,AREA OF MINIMAL FLOOD HAZARD,,Williamsbridge-Olinville
POINT (-73.75114763089167 40.75031172727931),4,Queens,411,23,26,11,6,Horace Harding Expressway E/B and Cloverdale Boulevard,Queens,2019-12-10T00:00:00.000,-73.751149,40.75032,X,AREA OF MINIMAL FLOOD HAZARD,,Oakland Gardens-Hollis Hills
POINT (-73.84901659561358 40.82325171647197),2,Bronx,209,18,87,34,14,Castle Hill Avenue and Lafayette Avenue,Bronx,2025-06-17T00:00:00.000,-73.849018,40.82326,X,AREA OF MINIMAL FLOOD HAZARD,,Castle Hill-Unionport
POINT (-73.89559058945999 40.66060074966348),3,Brooklyn,305,42,60,19,8,New Lots Avenue and Alabama Avenue,Brooklyn,2023-05-15T00:00:00.000,-73.895592,40.660609,X,AREA OF MINIMAL FLOOD HAZARD,4.0,East New York-New Lots
POINT (-73.89834957863218 40.842340714520944),2,Bronx,203,15,79,32,15,3 Avenue and East 174 Street,Bronx,2024-03-15T00:00:00.000,-73.898351,40.842349,X,AREA OF MINIMAL FLOOD HAZARD,,Claremont Village-Claremont (East)
POINT (-73.92076458203553 40.658001751808655),3,Brooklyn,317,41,58,19,9,Kings Highway with East 94 Street and Lenox Road,Brooklyn,2022-11-23T00:00:00.000,-73.920766,40.65801,X,AREA OF MINIMAL FLOOD HAZARD,6.0,East Flatbush-Remsen Village
POINT (-73.7544466383409 40.60720375588872),4,Queens,414,31,31,10,5,Beach Channel Drive and Birdsall Avenue,Queens,2025-08-28T00:00:00.000,-73.754448,40.607212,X,0.2 PCT ANNUAL CHANCE FLOOD HAZARD,1.0,Far Rockaway-Bayswater
POINT (-73.93221956963626 40.79635172444297),1,Manhattan,111,8,68,29,13,Pleasant Avenue and East 118 Street,Manhattan,2020-08-08T00:00:00.000,-73.932221,40.79636,X,0.2 PCT ANNUAL CHANCE FLOOD HAZARD,3.0,East Harlem (North)
POINT (-73.94374156671869 40.798606724753256),1,Manhattan,111,8,68,30,13,Park Avenue and East 115 Street,Manhattan,2020-01-06T00:00:00.000,-73.943743,40.798615,X,AREA OF MINIMAL FLOOD HAZARD,5.0,East Harlem (North)
POINT (-73.83130059664394 40.88470270414814),2,Bronx,212,12,83,36,16,"Boston Road, Dyre Avenue, and Steenwick Avenue",Bronx,2021-03-19T00:00:00.000,-73.831302,40.884711,X,AREA OF MINIMAL FLOOD HAZARD,,Eastchester-Edenwald-Baychester
POINT (-74.1526005108269 40.61755276753997),5,Staten Island,501,49,63,23,11,Deppe Place and Willow Road West,Staten Island,2024-12-04T00:00:00.000,-74.152602,40.617561,X,AREA OF MINIMAL FLOOD HAZARD,,Mariner's Harbor-Arlington-Graniteville
POINT (-73.89504159200547 40.630409755738384),3,Brooklyn,318,46,59,19,8,Seaview Avenue and Remsen Avenue,Brooklyn,2025-01-09T00:00:00.000,-73.895043,40.630418,X,AREA OF MINIMAL FLOOD HAZARD,3.0,Canarsie
POINT (-73.9623765721457 40.609977762230706),3,Brooklyn,315,48,45,22,9,Coney Island Avenue and Avenue P,Brooklyn,2024-04-15T00:00:00.000,-73.962378,40.609986,X,AREA OF MINIMAL FLOOD HAZARD,5.0,Gravesend (East)-Homecrest
POINT (-73.9516105704125 40.69058774586242),3,Brooklyn,303,36,57,25,8,Nostrand Avenue and Kosciusko Street,Brooklyn,2021-10-25T00:00:00.000,-73.951612,40.690596,X,AREA OF MINIMAL FLOOD HAZARD,,Bedford-Stuyvesant (West)
POINT (-74.23021249112813 40.52765878818078),5,Staten Island,503,51,62,24,11,Veterans Road West and Tyrellan Avenue,Staten Island,2025-10-30T00:00:00.000,-74.230214,40.527667,X,AREA OF MINIMAL FLOOD HAZARD,,Tottenville-Charleston
POINT (-74.09124153141859 40.60310876815594),5,Staten Island,502,50,64,23,11,Targee Street and Naples Street,Staten Island,2015-05-07T00:00:00.000,-74.091243,40.603117,X,AREA OF MINIMAL FLOOD HAZARD,,Grasmere-Arrochar-South Beach-Dongan Hills
POINT (-73.97898555708511 40.77038973109602),1,Manhattan,164,6,75,28,12,Central Park Post No. 37 West Drive and South of 65 Street Transverse Road,Manhattan,2022-09-17T00:00:00.000,-73.978987,40.770398,X,AREA OF MINIMAL FLOOD HAZARD,,Central Park
POINT (-73.97620456276196 40.68701674782008),3,Brooklyn,302,35,57,26,8,Fulton Street with Lafayette Avenue and Fort Greene Place,Brooklyn,2017-01-18T00:00:00.000,-73.976206,40.687025,X,AREA OF MINIMAL FLOOD HAZARD,,Fort Greene
POINT (-73.89482357765863 40.86205771075996),2,Bronx,207,15,78,33,13,East Fordham Road and Tiebout Avenue,Bronx,2025-06-03T00:00:00.000,-73.894825,40.862066,X,AREA OF MINIMAL FLOOD HAZARD,,Fordham Heights
POINT (-73.98311855797898 40.73483673839381),1,Manhattan,106,2,74,59,12,2 Avenue and East  18 Street,Manhattan,2022-07-14T00:00:00.000,-73.98312,40.734845,X,AREA OF MINIMAL FLOOD HAZARD,6.0,Gramercy
POINT (-73.88824257953036 40.87588470791825),2,Bronx,207,11,78,33,13,Jerome Avenue and East 205 Street,Bronx,2025-07-14T00:00:00.000,-73.888244,40.875893,X,AREA OF MINIMAL FLOOD HAZARD,,Bedford Park
POINT (-73.90479457654068 40.840904715008534),2,Bronx,204,15,79,32,15,Webster Avenue and 450' North of Claremont Parkway,Bronx,2023-12-30T00:00:00.000,-73.904796,40.840913,X,AREA OF MINIMAL FLOOD HAZARD,,Claremont Village-Claremont (East)
POINT (-73.80951061170703 40.761290727553074),4,Queens,407,20,40,16,6,Sanford Avenue and 156 Street,Queens,2023-10-20T00:00:00.000,-73.809512,40.761299,X,AREA OF MINIMAL FLOOD HAZARD,,East Flushing
POINT (-73.8902735797203 40.86110071031642),2,Bronx,206,15,78,33,15,East Fordham Road and 3 Avenue,Bronx,2022-06-18T00:00:00.000,-73.890275,40.861109,X,AREA OF MINIMAL FLOOD HAZARD,,Belmont
POINT (-73.94772857300961 40.66969575014497),3,Brooklyn,309,35,43,20,9,Eastern Parkway and New York Avenue,Brooklyn,2021-01-30T00:00:00.000,-73.94773,40.669704,X,AREA OF MINIMAL FLOOD HAZARD,,Crown Heights (South)
POINT (-73.99683755320395 40.737352738863805),1,Manhattan,105,2,66,27,10,6 Avenue and West  14 Street,Manhattan,2024-12-10T00:00:00.000,-73.996839,40.737361,X,AREA OF MINIMAL FLOOD HAZARD,6.0,Greenwich Village
POINT (-73.96294055953052 40.80931572344526),1,Manhattan,109,7,69,30,13,Broadway mid-block at West 118 Street,Manhattan,2023-10-07T00:00:00.000,-73.962942,40.809324,X,AREA OF MINIMAL FLOOD HAZARD,,Morningside Heights
POINT (-73.79234861885621 40.727131733417345),4,Queens,408,24,25,16,6,Utopia Parkway and  76 Avenue,Queens,2021-04-14T00:00:00.000,-73.79235,40.72714,X,AREA OF MINIMAL FLOOD HAZARD,,Pomonok-Electchester-Hillcrest
POINT (-73.87008059744032 40.66795474802583),3,Brooklyn,305,42,60,19,8,Linden Boulevard and Euclid Avenue,Brooklyn,2022-09-30T00:00:00.000,-73.870082,40.667963,X,AREA OF MINIMAL FLOOD HAZARD,3.0,East New York-City Line
POINT (-73.90920157478092 40.83303871649939),2,Bronx,204,16,77,32,15,Webster Avenue and 300' North of East 168 Street,Bronx,2019-02-28T00:00:00.000,-73.909203,40.833047,X,AREA OF MINIMAL FLOOD HAZARD,6.0,Concourse-Concourse Village
POINT (-73.89898657867501 40.821704718388915),2,Bronx,202,17,85,32,15,Rev. James Polite Avenue and East 163 Street,Bronx,2023-09-21T00:00:00.000,-73.898988,40.821713,X,AREA OF MINIMAL FLOOD HAZARD,,Longwood
POINT (-73.93781856440675 40.85212071350946),1,Manhattan,112,10,71,31,13,Ft. Washington Avenue and West 183 Street,Manhattan,2025-02-07T00:00:00.000,-73.93782,40.852129,X,AREA OF MINIMAL FLOOD HAZARD,,Washington Heights (North)
POINT (-74.18128250562326 40.546948782013956),5,Staten Island,503,51,62,24,11,Arden Avenue with Drumgoole Road East and West,Staten Island,2022-12-20T00:00:00.000,-74.181284,40.546957,X,AREA OF MINIMAL FLOOD HAZARD,,Annadale-Huguenot-Prince's Bay-Woodrow
POINT (-73.92817957848742 40.67042074910979),3,Brooklyn,308,41,55,20,9,Rochester Avenue and Saint Johns Place,Brooklyn,2023-08-09T00:00:00.000,-73.928181,40.670429,X,AREA OF MINIMAL FLOOD HAZARD,,Crown Heights (North)
POINT (-74.14794251435896 40.5756017752236),5,Staten Island,502,50,62,24,11,Richmond Hill Road and Latourette Golf Course (between Old Mill Road and Forest Hill Road),Staten Island,2023-05-22T00:00:00.000,-74.147944,40.57561,X,AREA OF MINIMAL FLOOD HAZARD,,Todt Hill-Emerson Hill-Lighthouse Hill-Manor Heights
POINT (-73.93857457869711 40.624221759054784),3,Brooklyn,318,45,41,21,9,Flatbush Avenue with East 38 Street and Hubbard Place,Brooklyn,2023-10-02T00:00:00.000,-73.938576,40.62423,X,AREA OF MINIMAL FLOOD HAZARD,4.0,Flatlands
POINT (-73.94139157840354 40.61762376016572),3,Brooklyn,318,45,41,21,9,Avenue N with East  34 Street and East 35 Street,Brooklyn,2023-06-20T00:00:00.000,-73.941393,40.617632,X,AREA OF MINIMAL FLOOD HAZARD,5.0,Flatlands
POINT (-73.98176055733424 40.74072473762855),1,Manhattan,106,2,74,59,12,3 Avenue and East  26 Street,Manhattan,2024-05-17T00:00:00.000,-73.981762,40.740733,X,AREA OF MINIMAL FLOOD HAZARD,,Murray Hill-Kips Bay
POINT (-73.98556755544648 40.75792573408228),1,Manhattan,105,3,75,28,12,Broadway with 7 Avenue and West 45 Street,Manhattan,2017-02-24T00:00:00.000,-73.985569,40.757934,X,AREA OF MINIMAL FLOOD HAZARD,,Midtown-Times Square
POINT (-73.88745658095613 40.85961671030583),2,Bronx,206,15,78,33,15,East Fordham Road and Bathgate Avenue,Bronx,2019-01-29T00:00:00.000,-73.887458,40.859625,X,AREA OF MINIMAL FLOOD HAZARD,,Belmont
POINT (-74.12708552048551 40.576360774691146),5,Staten Island,502,50,64,24,11,Richmond Road and Rockland Avenue,Staten Island,2022-09-20T00:00:00.000,-74.127087,40.576369,X,AREA OF MINIMAL FLOOD HAZARD,,Oakwood-Richmondtown
POINT (-73.96369957068116 40.62736275865766),3,Brooklyn,314,44,48,22,9,Avenue I and East  13 Street,Brooklyn,2019-12-13T00:00:00.000,-73.963701,40.627371,X,AREA OF MINIMAL FLOOD HAZARD,,Midwood
POINT (-73.85615858887252 40.89558870218089),2,Bronx,212,11,81,36,15,White Plains Road and East 236 Street,Bronx,2025-09-17T00:00:00.000,-73.85616,40.895597,X,AREA OF MINIMAL FLOOD HAZARD,,Wakefield-Woodlawn
POINT (-73.8542105924431 40.842355713196646),2,Bronx,209,18,87,34,14,East Tremont Avenue and Bronxdale Avenue,Bronx,2023-11-14T00:00:00.000,-73.854212,40.842364,X,AREA OF MINIMAL FLOOD HAZARD,,Parkchester
POINT (-73.82501804996525 40.85674568112326),2,Bronx,228,13,82,34,14,Pelham Parkway and Bruckner Expressway N/B Entrance,Bronx,2023-12-01T00:00:00.000,-73.825019449,40.8567539723,X,0.2 PCT ANNUAL CHANCE FLOOD HAZARD,5.0,Pelham Bay Park
POINT (-73.84933859451293 40.8301397154233),2,Bronx,209,18,87,34,14,Cross Bronx Expressway North Service Road between Watson Avenue and Haviland Avenue,Bronx,2023-12-05T00:00:00.000,-73.84934,40.830148,X,AREA OF MINIMAL FLOOD HAZARD,,Castle Hill-Unionport
POINT (-73.91985557178528 40.831940717324905),2,Bronx,204,16,77,32,15,Grand Concourse and East 166 Street,Bronx,2024-10-08T00:00:00.000,-73.919857,40.831949,X,AREA OF MINIMAL FLOOD HAZARD,,Concourse-Concourse Village
POINT (-74.0876163472235 40.6316392747123),5,Staten Island,501,49,61,24,11,Victory Boulevard and Woodstock Avenue,Staten Island,2024-04-12T00:00:00.000,-74.0876178166,40.6316475124,X,AREA OF MINIMAL FLOOD HAZARD,,West New Brighton-Silver Lake-Grymes Hill
POINT (-73.97919255602476 40.771772730873536),1,Manhattan,107,6,75,28,12,Central Park West and West  65 Street,Manhattan,2015-10-20T00:00:00.000,-73.979194,40.771781,X,AREA OF MINIMAL FLOOD HAZARD,,Central Park
POINT (-74.00236355415203 40.68572874864923),3,Brooklyn,306,39,51,26,10,Columbia Street and DeGraw Street,Brooklyn,2023-09-28T00:00:00.000,-74.002365,40.685737,X,AREA OF MINIMAL FLOOD HAZARD,2.0,Carroll Gardens-Cobble Hill-Gowanus-Red Hook
POINT (-73.96715156116053 40.7567557332305),1,Manhattan,106,4,73,28,12,2 Avenue and East  53 Street,Manhattan,2022-04-18T00:00:00.000,-73.967153,40.756764,X,AREA OF MINIMAL FLOOD HAZARD,,East Midtown-Turtle Bay
POINT (-73.75183763878744 40.60527775592609),4,Queens,414,31,23,10,5,Central Avenue and Fome Place,Queens,2023-06-01T00:00:00.000,-73.751839,40.605286,X,AREA OF MINIMAL FLOOD HAZARD,1.0,Far Rockaway-Bayswater
POINT (-73.89806057739843 40.84701971346533),2,Bronx,206,15,86,32,15,East Tremont Avenue and Washington Avenue,Bronx,2024-02-15T00:00:00.000,-73.898062,40.847028,X,AREA OF MINIMAL FLOOD HAZARD,,Tremont
POINT (-74.09761556842592 40.574764353870506),5,Staten Island,502,50,64,24,11,Midland Avenue and Mason Avenue,Staten Island,2024-04-05T00:00:00.000,-74.0976170378,40.5747725798,AE,,2.0,New Dorp-Midland Beach
POINT (-73.918309581756 40.676787747589124),3,Brooklyn,303,41,55,25,8,Atlantic Avenue and Dewey Place,Brooklyn,2024-06-10T00:00:00.000,-73.918311,40.676796,X,AREA OF MINIMAL FLOOD HAZARD,,Ocean Hill
POINT (-73.82245761129262 40.70364673935335),4,Queens,409,29,24,15,5,Hillside Avenue with Metropolitan Avenue and 130 Street,Queens,2024-04-19T00:00:00.000,-73.822459,40.703655,X,AREA OF MINIMAL FLOOD HAZARD,,Richmond Hill
POINT (-74.01438954923135 40.70359074586672),1,Manhattan,101,1,61,27,10,State Street and Bridge Street,Manhattan,2023-06-14T00:00:00.000,-74.014391,40.703599,X,AREA OF MINIMAL FLOOD HAZARD,2.0,Financial District-Battery Park City
POINT (-73.93111857773386 40.66878974917221),3,Brooklyn,309,41,55,20,9,Eastern Parkway and Utica Avenue,Brooklyn,2024-08-01T00:00:00.000,-73.93112,40.668798,X,AREA OF MINIMAL FLOOD HAZARD,,Crown Heights (South)
POINT (-73.862426600486 40.667777747375276),3,Brooklyn,305,42,60,19,8,Loring Avenue and Eldert Lane,Brooklyn,2020-11-03T00:00:00.000,-73.862428,40.667786,X,AREA OF MINIMAL FLOOD HAZARD,3.0,East New York-City Line
POINT (-73.93323657577352 40.689554745836),3,Brooklyn,303,36,56,25,8,Stuyvesant Avenue and Lexington Avenue,Brooklyn,2023-07-26T00:00:00.000,-73.933238,40.689563,X,AREA OF MINIMAL FLOOD HAZARD,,Bedford-Stuyvesant (East)
POINT (-74.08028051438397 40.64478497454281),5,Staten Island,501,49,61,23,11,Hamilton Avenue and Saint Marks Place,Staten Island,2024-01-08T00:00:00.000,-74.080281982,40.6447932151,X,AREA OF MINIMAL FLOOD HAZARD,,St. George-New Brighton
POINT (-73.97972356269642 40.66122075297881),3,Brooklyn,355,39,44,20,10,Bartel Pritchard Square North and Prospect Park West,Brooklyn,2023-09-22T00:00:00.000,-73.979725,40.661229,X,AREA OF MINIMAL FLOOD HAZARD,,Prospect Park
POINT (-74.09963697425941 40.58837987703599),5,Staten Island,502,50,64,23,11,Buel Avenue and Jefferson Street,Staten Island,2025-06-10T00:00:00.000,-74.0996384454,40.5883881056,X,AREA OF MINIMAL FLOOD HAZARD,6.0,Grasmere-Arrochar-South Beach-Dongan Hills
POINT (-73.96899156764842 40.63460975766383),3,Brooklyn,312,40,44,21,9,18 Avenue and East   9 Street,Brooklyn,2024-06-03T00:00:00.000,-73.968993,40.634618,X,AREA OF MINIMAL FLOOD HAZARD,,Flatbush (West)-Ditmas Park-Parkville
POINT (-74.10653652382267 40.634695762488974),5,Staten Island,501,49,63,23,11,Castleton Avenue and Bard Avenue,Staten Island,2023-09-08T00:00:00.000,-74.106538,40.634704,X,AREA OF MINIMAL FLOOD HAZARD,,West New Brighton-Silver Lake-Grymes Hill
POINT (-73.8151736155066 40.67129574468055),4,Queens,410,28,31,10,5,133 Avenue and 123 Street,Queens,2023-04-26T00:00:00.000,-73.815175,40.671304,X,AREA OF MINIMAL FLOOD HAZARD,5.0,South Ozone Park
POINT (-73.90371258234592 40.744902733529074),4,Queens,402,26,30,12,6,Woodside Avenue and  61 Street (West Leg),Queens,2025-04-01T00:00:00.000,-73.903714,40.744911,X,AREA OF MINIMAL FLOOD HAZARD,,Woodside
POINT (-73.93678957111395 40.75987473206633),4,Queens,401,26,36,59,7,21 Street and  36 Avenue,Queens,2025-10-03T00:00:00.000,-73.936791,40.759883,X,AREA OF MINIMAL FLOOD HAZARD,4.0,Queensbridge-Ravenswood-Dutch Kills
POINT (-73.91487357240868 40.85103671302501),2,Bronx,205,14,86,31,13,University Avenue and Morton Place,Bronx,2022-03-28T00:00:00.000,-73.914875,40.851045,X,AREA OF MINIMAL FLOOD HAZARD,,University Heights (South)-Morris Heights
POINT (-73.89642458034255 40.81419471958596),2,Bronx,202,17,84,29,14,Bruckner Boulevard and East 156 Street,Bronx,2023-05-31T00:00:00.000,-73.896426,40.814203,X,AREA OF MINIMAL FLOOD HAZARD,6.0,Hunts Point
POINT (-73.8602225970648 40.72934673487398),4,Queens,406,30,28,15,6,Queens Boulevard with  64 Avenue and  64 Road,Queens,2021-03-30T00:00:00.000,-73.860224,40.729355,X,AREA OF MINIMAL FLOOD HAZARD,,Rego Park
POINT (-74.08849553277926 40.58477977122068),5,Staten Island,502,50,64,24,11,Seaview Avenue and Mason Avenue,Staten Island,2024-10-02T00:00:00.000,-74.088497,40.584788,X,AREA OF MINIMAL FLOOD HAZARD,2.0,New Dorp-Midland Beach
POINT (-73.89866758366139 40.74052673412124),4,Queens,402,26,30,12,6,Queens Boulevard with 66 Street and BQE Eastbound Entrance,Queens,2022-04-10T00:00:00.000,-73.898669,40.740535,X,AREA OF MINIMAL FLOOD HAZARD,,Woodside
POINT (-73.95554056791272 40.707584743183595),3,Brooklyn,301,34,50,18,7,Broadway and Keap Street,Brooklyn,2025-08-07T00:00:00.000,-73.955542,40.707593,X,AREA OF MINIMAL FLOOD HAZARD,,South Williamsburg
POINT (-73.93286056646494 40.850497714014075),1,Manhattan,112,10,72,31,13,Saint Nicholas Avenue and West 183 Street,Manhattan,2022-06-24T00:00:00.000,-73.932862,40.850506,X,AREA OF MINIMAL FLOOD HAZARD,,Washington Heights (North)
POINT (-73.89736858688579 40.694101743535626),4,Queens,405,32,38,18,7,Cypress Avenue and Cooper Avenue,Queens,2022-08-29T00:00:00.000,-73.89737,40.69411,X,AREA OF MINIMAL FLOOD HAZARD,,Highland Park-Cypress Hills Cemeteries (North)
POINT (-73.99370961783052 40.623147373072484),3,Brooklyn,311,43,49,17,11,16 Avenue and 63 Street,Brooklyn,2024-01-24T00:00:00.000,-73.9937110566,40.623155612,X,AREA OF MINIMAL FLOOD HAZARD,,Bensonhurst
POINT (-73.9189885754614 40.778678727729535),4,Queens,401,22,36,59,14,21 Street and  23 Avenue,Queens,2024-04-24T00:00:00.000,-73.91899,40.778687,X,AREA OF MINIMAL FLOOD HAZARD,,Astoria (North)-Ditmars-Steinway
POINT (-74.01065655017204 40.71742674315897),1,Manhattan,101,1,66,27,10,Greenwich Street and Duane Street,Manhattan,2024-03-21T00:00:00.000,-74.010658,40.717435,X,AREA OF MINIMAL FLOOD HAZARD,4.0,Tribeca-Civic Center
POINT (-73.85215060154864 40.69412474213093),4,Queens,409,32,38,15,7,Woodhaven Boulevard and  86 Drive (East Leg),Queens,2018-10-23T00:00:00.000,-73.852152,40.694133,X,AREA OF MINIMAL FLOOD HAZARD,,Woodhaven
