the_geom,borocode,boroname,borocd,coundist,assemdist,stsendist,congdist,location,borough,date_insta,point_x,point_y,femafldz,femafldt,hrcevac,ntaname
POINT (-73.93702356632511 40.83646171656637),1,Manhattan,112,10,72,31,13,Edgecombe Avenue and West 164 Street,Manhattan,2014-03-01T00:00:00.000,-73.937025,40.83647,X,AREA OF MINIMAL FLOOD HAZARD,,Highbridge Park
POINT (-73.97274055892292 40.7695567314488),1,Manhattan,164,6,75,28,12,Central Park Post No. 41 Central Drive and West of East Drive,Manhattan,2024-03-25T00:00:00.000,-73.972742,40.769565,X,AREA OF MINIMAL FLOOD HAZARD,,Central Park
POINT (-73.90189857820071 40.83170371676607),2,Bronx,203,17,79,32,15,East 169 Street and Franklin Avenue,Bronx,2025-09-08T00:00:00.000,-73.9019,40.831712,X,AREA OF MINIMAL FLOOD HAZARD,,Morrisania
POINT (-73.8539325900873 40.887378703853855),2,Bronx,212,12,83,36,15,Bronxwood Avenue and East 227 Street,Bronx,2023-09-15T00:00:00.000,-73.853934,40.887387,X,AREA OF MINIMAL FLOOD HAZARD,,Williamsbridge-Olinville
POINT (-73.94983457597787 40.6066577623893),3,Brooklyn,315,48,41,22,9,Avenue R and East  23 Street,Brooklyn,2022-09-14T00:00:00.000,-73.949836,40.606666,X,AREA OF MINIMAL FLOOD HAZARD,4.0,Madison
POINT (-73.89227658185203 40.81888671927617),2,Bronx,202,17,85,32,14,Bruckner Boulevard and Barretto Street,Bronx,2025-03-11T00:00:00.000,-73.892278,40.818895,X,AREA OF MINIMAL FLOOD HAZARD,,Hunts Point
POINT (-73.99340055507466 40.715347742239324),1,Manhattan,103,1,65,27,10,Canal Street and Eldridge Street,Manhattan,2023-04-10T00:00:00.000,-73.993402,40.715356,X,AREA OF MINIMAL FLOOD HAZARD,,Chinatown-Two Bridges
POINT (-73.93226357949125 40.64194075496678),3,Brooklyn,317,45,58,21,9,Avenue D and Schenectady Avenue,Brooklyn,2025-11-14T00:00:00.000,-73.932265,40.641949,X,AREA OF MINIMAL FLOOD HAZARD,5.0,East Flatbush-Farragut
POINT (-73.974147566644 40.6262057590877),3,Brooklyn,312,44,48,22,9,Avenue I and East   3 Street,Brooklyn,2025-10-23T00:00:00.000,-73.974149,40.626214,X,AREA OF MINIMAL FLOOD HAZARD,,Mapleton-Midwood (West)
POINT (-73.91251458417375 40.665200749901736),3,Brooklyn,316,41,55,25,8,Thomas Boyland Street and Blake Avenue,Brooklyn,2025-05-30T00:00:00.000,-73.912516,40.665209,X,AREA OF MINIMAL FLOOD HAZARD,6.0,Brownsville
POINT (-73.82084428790074 40.86775265256649),2,Bronx,210,12,82,36,16,Hutchinson River Parkway N/B Exit with Bartow Avenue and Hutchinson River Parkway East,Bronx,2024-05-15T00:00:00.000,-73.8208456866,40.8677609456,X,0.2 PCT ANNUAL CHANCE FLOOD HAZARD,4.0,Co-op City
POINT (-73.77934861992263 40.782608722342815),4,Queens,407,19,26,11,3,212 Street between 18 Avenue and 23 Avenue (mid-block),Queens,2020-02-20T00:00:00.000,-73.77935,40.782617,X,AREA OF MINIMAL FLOOD HAZARD,6.0,Bay Terrace-Clearview
POINT (-73.91295157530749 40.814259720167705),2,Bronx,201,8,84,29,14,East 149 Street and Saint Anns Avenue,Bronx,2025-10-02T00:00:00.000,-73.912953,40.814268,X,AREA OF MINIMAL FLOOD HAZARD,6.0,Mott Haven-Port Morris
POINT (-73.94193956684778 40.791306726033554),1,Manhattan,111,8,68,29,13,2 Avenue and East 107 Street,Manhattan,2016-11-23T00:00:00.000,-73.941941,40.791315,X,0.2 PCT ANNUAL CHANCE FLOOD HAZARD,3.0,East Harlem (South)
POINT (-73.90584057664141 40.831049716838464),2,Bronx,203,16,79,32,15,3rd Avenue and East 168 Street,Bronx,2020-10-05T00:00:00.000,-73.905842,40.831058,X,AREA OF MINIMAL FLOOD HAZARD,,Claremont Village-Claremont (East)
POINT (-73.93901656547526 40.832359717701884),1,Manhattan,112,10,72,31,13,Harlem River Driveway 800' N/o West 155 Street,Manhattan,2018-05-21T00:00:00.000,-73.939018,40.832368,X,AREA OF MINIMAL FLOOD HAZARD,,Highbridge Park
POINT (-73.98759655340646 40.770415731976136),1,Manhattan,107,6,67,47,12,10 Avenue and West  59 Street,Manhattan,2024-11-02T00:00:00.000,-73.987598,40.770424,X,AREA OF MINIMAL FLOOD HAZARD,,Upper West Side-Lincoln Square
POINT (-73.90264557734903 40.83886671559387),2,Bronx,203,16,79,32,15,Washington Avenue and Claremont Parkway,Bronx,2025-01-13T00:00:00.000,-73.902647,40.838875,X,AREA OF MINIMAL FLOOD HAZARD,,Claremont Village-Claremont (East)
POINT (-73.98932455777383 40.6909927476163),3,Brooklyn,302,33,52,26,10,Boerum Place and Livingston Street,Brooklyn,2012-05-09T00:00:00.000,-73.989326,40.691001,X,AREA OF MINIMAL FLOOD HAZARD,,Brooklyn Heights
POINT (-73.88593458080632 40.8659167098173),2,Bronx,207,15,78,33,15,Webster Avenue and East 198 Street,Bronx,2025-08-11T00:00:00.000,-73.885936,40.865925,X,AREA OF MINIMAL FLOOD HAZARD,,Belmont
POINT (-73.95808557232161 40.62309675958518),3,Brooklyn,314,44,48,22,9,Avenue K and East  18 Street,Brooklyn,2025-08-14T00:00:00.000,-73.958087,40.623105,X,AREA OF MINIMAL FLOOD HAZARD,,Midwood
POINT (-73.90429157489879 40.85769971149626),2,Bronx,205,14,86,33,13,Jerome Avenue and Buchanan Place,Bronx,2019-08-09T00:00:00.000,-73.904293,40.857708,X,AREA OF MINIMAL FLOOD HAZARD,,Fordham Heights
POINT (-73.90187657678383 40.84023771510734),2,Bronx,203,15,79,32,15,Washington Avenue and East 172 Street,Bronx,2024-07-25T00:00:00.000,-73.901878,40.840246,X,AREA OF MINIMAL FLOOD HAZARD,,Claremont Village-Claremont (East)
POINT (-73.8478666041313 40.68147874382927),4,Queens,409,32,23,15,5,Rockaway Boulevard and 103 Avenue,Queens,2022-10-19T00:00:00.000,-73.847868,40.681487,X,AREA OF MINIMAL FLOOD HAZARD,5.0,Ozone Park
POINT (-73.89379258486156 40.74768173281265),4,Queens,403,25,30,12,6,Broadway and  72 Street,Queens,2024-02-26T00:00:00.000,-73.893794,40.74769,X,AREA OF MINIMAL FLOOD HAZARD,,Elmhurst
POINT (-73.7329936392487 40.71259073442848),4,Queens,413,27,33,14,5,Hempstead Avenue and 221 Street,Queens,2016-10-07T00:00:00.000,-73.732995,40.712599,X,AREA OF MINIMAL FLOOD HAZARD,,Queens Village
POINT (-73.85678259335079 40.81565271809361),2,Bronx,209,18,85,34,14,White Plains Road and Lacombe Avenue,Bronx,2025-03-20T00:00:00.000,-73.856784,40.815661,X,AREA OF MINIMAL FLOOD HAZARD,4.0,Soundview-Clason Point
POINT (-73.92853956996453 40.8120287213359),2,Bronx,201,8,84,29,15,East 138 Street and Canal Place,Bronx,2024-01-05T00:00:00.000,-73.928541,40.812037,X,0.2 PCT ANNUAL CHANCE FLOOD HAZARD,3.0,Mott Haven-Port Morris
POINT (-73.86761858718688 40.857228710513745),2,Bronx,211,13,78,33,15,Pelham Parkway Westbound and White Plains Road,Bronx,2023-04-22T00:00:00.000,-73.86762,40.857237,X,AREA OF MINIMAL FLOOD HAZARD,,Pelham Parkway-Van Nest
POINT (-73.87113058437683 40.8798017061052),2,Bronx,207,11,81,33,15,Webster Avenue and 800' North of Gun Hill Road,Bronx,2019-02-19T00:00:00.000,-73.871132,40.87981,X,AREA OF MINIMAL FLOOD HAZARD,,Norwood
POINT (-73.9783485617474 40.69614174599673),3,Brooklyn,302,35,57,25,7,Park Avenue and St Edwards Street,Brooklyn,2020-12-11T00:00:00.000,-73.97835,40.69615,X,AREA OF MINIMAL FLOOD HAZARD,5.0,Fort Greene
POINT (-74.02423455006094 40.6328507600411),3,Brooklyn,310,47,64,26,11,4 Avenue and  72 Street,Brooklyn,2025-02-24T00:00:00.000,-74.024236,40.632859,X,AREA OF MINIMAL FLOOD HAZARD,,Bay Ridge
POINT (-73.98431255504184 40.76984073128746),1,Manhattan,107,6,75,47,12,Columbus Avenue and West  60 Street,Manhattan,2024-11-25T00:00:00.000,-73.984314,40.769849,X,AREA OF MINIMAL FLOOD HAZARD,,Upper West Side-Lincoln Square
POINT (-73.95037756228194 40.82143772006952),1,Manhattan,109,9,70,30,13,Amsterdam Avenue and West 139 Street,Manhattan,2023-11-21T00:00:00.000,-73.950379,40.821446,X,AREA OF MINIMAL FLOOD HAZARD,,Manhattanville-West Harlem
POINT (-73.8881565863209 40.75525673122332),4,Queens,403,25,34,13,14,Northern Boulevard and  79 Street,Queens,2020-03-30T00:00:00.000,-73.888158,40.755265,X,AREA OF MINIMAL FLOOD HAZARD,,Jackson Heights
POINT (-74.24163748920068 40.50482279267207),5,Staten Island,503,51,62,24,11,Hylan Boulevard and Yetman Avenue,Staten Island,2020-03-10T00:00:00.000,-74.241639,40.504831,X,AREA OF MINIMAL FLOOD HAZARD,5.0,Tottenville-Charleston
POINT (-74.11385052159896 40.64288476121681),5,Staten Island,501,49,61,23,11,Richmond Terrace and Bement Avenue,Staten Island,2025-06-04T00:00:00.000,-74.113852,40.642893,X,AREA OF MINIMAL FLOOD HAZARD,4.0,West New Brighton-Silver Lake-Grymes Hill
POINT (-73.95825357107915 40.64852375456146),3,Brooklyn,314,40,42,21,9,Flatbush Avenue and Snyder Avenue,Brooklyn,2022-06-20T00:00:00.000,-73.958255,40.648532,X,AREA OF MINIMAL FLOOD HAZARD,,East Flatbush-Erasmus
POINT (-73.87852758942665 40.7544077305513),4,Queens,403,25,34,13,14,34 Avenue and  89 Street,Queens,2025-03-10T00:00:00.000,-73.878529,40.754416,X,AREA OF MINIMAL FLOOD HAZARD,,Jackson Heights
POINT (-73.86015859213536 40.82159171764622),2,Bronx,209,18,87,34,14,Lafayette Avenue and Underhill Avenue,Bronx,2021-04-23T00:00:00.000,-73.86016,40.8216,X,AREA OF MINIMAL FLOOD HAZARD,4.0,Soundview-Clason Point
POINT (-73.8996155883123 40.67135174792304),3,Brooklyn,305,37,55,19,8,Pitkin Avenue and Williams Avenue,Brooklyn,2020-01-21T00:00:00.000,-73.899617,40.67136,X,AREA OF MINIMAL FLOOD HAZARD,,East New York (North)
POINT (-74.12180851834489 40.63918176220006),5,Staten Island,501,49,61,23,11,Alaska Street and Richmond Terrace,Staten Island,2021-09-21T00:00:00.000,-74.12181,40.63919,X,AREA OF MINIMAL FLOOD HAZARD,5.0,Port Richmond
POINT (-73.95893957394406 40.58220876740552),3,Brooklyn,313,48,45,23,8,Neptune Avenue and East  11 Street,Brooklyn,2022-01-25T00:00:00.000,-73.958941,40.582217,AE,,1.0,Brighton Beach
POINT (-73.91369757775351 40.765472730214725),4,Queens,401,22,36,12,14,Steinway Street and  28 Avenue,Queens,2025-03-14T00:00:00.000,-73.913699,40.765481,X,AREA OF MINIMAL FLOOD HAZARD,,Astoria (East)-Woodside (North)
POINT (-74.14421145564789 40.62338835544219),5,Staten Island,501,50,61,24,11,Willowbrook Road and Gloria Court,Staten Island,2024-12-11T00:00:00.000,-74.1442129425,40.6233965888,X,AREA OF MINIMAL FLOOD HAZARD,,Westerleigh-Castleton Corners
POINT (-73.93646356583167 40.84047371580734),1,Manhattan,112,10,72,31,13,Amsterdam Avenue and West 169 Street,Manhattan,2025-09-10T00:00:00.000,-73.936465,40.840482,X,AREA OF MINIMAL FLOOD HAZARD,,Washington Heights (South)
POINT (-73.97510156247444 40.689697747319514),3,Brooklyn,302,35,57,25,7,Dekalb Avenue and South Portland Avenue,Brooklyn,2016-11-21T00:00:00.000,-73.975103,40.689706,X,AREA OF MINIMAL FLOOD HAZARD,,Fort Greene
POINT (-74.13404151495459 40.63278676348686),5,Staten Island,501,49,61,23,11,Post Avenue and Heberton Avenue,Staten Island,2025-06-06T00:00:00.000,-74.134043,40.632795,X,AREA OF MINIMAL FLOOD HAZARD,5.0,Port Richmond
POINT (-73.8977695769597 40.87168570914606),2,Bronx,208,11,81,31,13,Reservoir Avenue and West 197 Street,Bronx,2023-07-08T00:00:00.000,-73.897771,40.871694,X,AREA OF MINIMAL FLOOD HAZARD,,Bedford Park
POINT (-73.91225384240127 40.829410527252),2,Bronx,204,16,77,32,15,East 166 Street and Clay Avenue,Bronx,2024-10-18T00:00:00.000,-73.9122552683,40.8294188102,X,AREA OF MINIMAL FLOOD HAZARD,5.0,Concourse-Concourse Village
POINT (-73.9791795797751 40.610730488960094),3,Brooklyn,311,43,47,17,9,Avenue O and West 5 Street,Brooklyn,2024-05-14T00:00:00.000,-73.9791810141,40.6107387263,X,AREA OF MINIMAL FLOOD HAZARD,6.0,Bensonhurst
POINT (-73.91048757490098 40.83072971724092),2,Bronx,203,16,79,32,15,Webster Avenue and East 167 Street,Bronx,2019-06-24T00:00:00.000,-73.910489,40.830738,X,AREA OF MINIMAL FLOOD HAZARD,5.0,Concourse-Concourse Village
POINT (-73.84857705863065 40.73094041288482),4,Queens,406,29,28,15,6,108 Street and 65 Road,Queens,2024-09-09T00:00:00.000,-73.848578458,40.7309486778,X,AREA OF MINIMAL FLOOD HAZARD,,Forest Hills
POINT (-73.77383562922158 40.659663746218335),4,Queens,413,31,31,10,5,Rockaway Boulevard and Farmers Boulevard,Queens,2022-02-15T00:00:00.000,-73.773837,40.659672,X,AREA OF MINIMAL FLOOD HAZARD,3.0,Springfield Gardens (South)-Brookville
POINT (-73.93836257342959 40.701535743471496),3,Brooklyn,304,34,53,18,7,Flushing Avenue and Garden Street,Brooklyn,2020-10-07T00:00:00.000,-73.938364,40.701544,X,AREA OF MINIMAL FLOOD HAZARD,,Bushwick (West)
POINT (-74.16353250965152 40.579295775152175),5,Staten Island,502,51,63,24,11,Marsh Avenue and Staten Island Mall Drive,Staten Island,2025-02-07T00:00:00.000,-74.163534,40.579304,X,AREA OF MINIMAL FLOOD HAZARD,,New Springville-Willowbrook-Bulls Head-Travis
POINT (-73.91112057387127 40.849410713156),2,Bronx,205,14,77,33,15,Jerome Avenue and Mount Hope Place,Bronx,2025-09-18T00:00:00.000,-73.911122,40.849419,X,AREA OF MINIMAL FLOOD HAZARD,,Mount Hope
POINT (-73.886433588951 40.72164373771907),4,Queens,405,30,28,15,6,Eliot Avenue and  72 Street,Queens,2016-12-07T00:00:00.000,-73.886435,40.721652,X,AREA OF MINIMAL FLOOD HAZARD,,Middle Village
POINT (-73.82167560426758 40.82619371459991),2,Bronx,210,13,82,34,14,East Tremont Avenue and Randall Avenue,Bronx,2023-08-10T00:00:00.000,-73.821677,40.826202,X,AREA OF MINIMAL FLOOD HAZARD,,Throgs Neck-Schuylerville
POINT (-73.89655957719788 40.868555709496185),2,Bronx,207,14,78,33,13,Jerome Avenue and West 195 Street,Bronx,2019-04-16T00:00:00.000,-73.896561,40.868564,X,AREA OF MINIMAL FLOOD HAZARD,,Bedford Park
POINT (-73.95663248569032 40.644649314574835),3,Brooklyn,314,40,42,21,9,Beverley Road and East 22 Street,Brooklyn,2025-07-14T00:00:00.000,-73.9566339144,40.6446575594,X,AREA OF MINIMAL FLOOD HAZARD,6.0,Flatbush
POINT (-74.21775349444775 40.53144078685276),5,Staten Island,503,51,62,24,11,Bloomingdale Road and Englewood Avenue,Staten Island,2024-12-28T00:00:00.000,-74.217755,40.531449,X,AREA OF MINIMAL FLOOD HAZARD,,Annadale-Huguenot-Prince's Bay-Woodrow
POINT (-73.93275057923722 40.63722775584674),3,Brooklyn,317,45,58,21,9,Farragut Road and East 46 Street,Brooklyn,2023-09-21T00:00:00.000,-73.932752,40.637236,X,AREA OF MINIMAL FLOOD HAZARD,5.0,East Flatbush-Farragut
POINT (-73.86715558663202 40.87143270811236),2,Bronx,212,12,80,36,15,White Plains Road and Burke Avenue,Bronx,2024-07-13T00:00:00.000,-73.867157,40.871441,X,AREA OF MINIMAL FLOOD HAZARD,,Williamsbridge-Olinville
POINT (-74.169801506965 40.5757627762011),5,Staten Island,502,51,63,24,11,Richmond Avenue and 400' South of Yukon Avenue,Staten Island,2024-08-20T00:00:00.000,-74.169803,40.575771,X,AREA OF MINIMAL FLOOD HAZARD,3.0,New Springville-Willowbrook-Bulls Head-Travis
POINT (-73.95398356473389 40.77881372868613),1,Manhattan,108,5,76,28,12,3 Avenue and East  86 Street,Manhattan,2023-11-12T00:00:00.000,-73.953985,40.778822,X,AREA OF MINIMAL FLOOD HAZARD,,Upper East Side-Yorkville
POINT (-74.10976052664674 40.570458775271824),5,Staten Island,502,50,64,24,11,Hylan Boulevard and New Dorp Lane,Staten Island,2025-05-22T00:00:00.000,-74.109762,40.570467,X,AREA OF MINIMAL FLOOD HAZARD,4.0,New Dorp-Midland Beach
POINT (-73.95127656235489 40.82020072071186),1,Manhattan,109,9,70,30,13,Amsterdam Avenue and Between 136 Street and 138 Street,Manhattan,2020-12-10T00:00:00.000,-73.951278,40.820209,X,AREA OF MINIMAL FLOOD HAZARD,,Manhattanville-West Harlem
POINT (-74.08457053236705 40.619803764445344),5,Staten Island,501,49,61,23,11,Targee Street and Laurel Avenue,Staten Island,2023-07-31T00:00:00.000,-74.084572,40.619812,X,AREA OF MINIMAL FLOOD HAZARD,,Tompkinsville-Stapleton-Clifton-Fox Hills
POINT (-73.99156055350386 40.74969773600301),1,Manhattan,105,3,75,28,12,7 Avenue and West  32 Street,Manhattan,2012-07-05T00:00:00.000,-73.991562,40.749706,X,AREA OF MINIMAL FLOOD HAZARD,,Midtown South-Flatiron-Union Square
POINT (-73.89670557593166 40.89579770426001),2,Bronx,226,11,81,33,15,Broadway and West 251 Street,Bronx,2023-04-14T00:00:00.000,-73.896707,40.895806,X,AREA OF MINIMAL FLOOD HAZARD,,Van Cortlandt Park
POINT (-73.96751056896245 40.63169875792382),3,Brooklyn,314,45,44,21,9,Foster Avenue with East 8 Street North Leg and East 10 Street,Brooklyn,2023-06-20T00:00:00.000,-73.967512,40.631707,X,AREA OF MINIMAL FLOOD HAZARD,,Flatbush (West)-Ditmas Park-Parkville
POINT (-73.90406858450574 40.69884974296908),4,Queens,405,34,38,12,7,Cypress Avenue and Weirfield Street,Queens,2022-10-26T00:00:00.000,-73.90407,40.698858,X,AREA OF MINIMAL FLOOD HAZARD,,Ridgewood
POINT (-73.94861757024846 40.70148574350978),3,Brooklyn,301,33,53,18,7,Harrison Avenue and Wallabout Street,Brooklyn,2025-01-07T00:00:00.000,-73.948619,40.701494,X,AREA OF MINIMAL FLOOD HAZARD,3.0,South Williamsburg
POINT (-73.98916655879731 40.688607747804824),3,Brooklyn,302,33,52,26,10,Atlantic Avenue and Smith Street,Brooklyn,2013-08-15T00:00:00.000,-73.989168,40.688616,X,AREA OF MINIMAL FLOOD HAZARD,6.0,Downtown Brooklyn-DUMBO-Boerum Hill
POINT (-73.81100173656729 40.664918199212025),4,Queens,410,28,31,10,5,150 Avenue and 130 Street,Queens,2025-10-09T00:00:00.000,-73.8110031197,40.664926453,X,AREA OF MINIMAL FLOOD HAZARD,3.0,South Ozone Park
POINT (-73.9912305536787 40.760344733325525),1,Manhattan,104,3,75,47,12,9 Avenue and West  45 Street,Manhattan,2024-06-10T00:00:00.000,-73.991232,40.760353,X,AREA OF MINIMAL FLOOD HAZARD,,Hell's Kitchen
POINT (-73.9887285644804 40.59299276652491),3,Brooklyn,313,43,47,17,11,Bath Avenue and  26 Avenue,Brooklyn,2024-12-31T00:00:00.000,-73.98873,40.593001,X,0.2 PCT ANNUAL CHANCE FLOOD HAZARD,2.0,Gravesend (West)
POINT (-73.93833257827309 40.62563775876831),3,Brooklyn,318,45,41,21,9,Avenue K and East  39 Street,Brooklyn,2024-06-10T00:00:00.000,-73.938334,40.625646,X,AREA OF MINIMAL FLOOD HAZARD,4.0,Flatlands
POINT (-73.88771858310903 40.811871720034695),2,Bronx,202,17,84,29,14,Randall Avenue and Manida Street,Bronx,2021-06-03T00:00:00.000,-73.88772,40.81188,X,AREA OF MINIMAL FLOOD HAZARD,6.0,Hunts Point
POINT (-73.91094758459022 40.65905775057275),3,Brooklyn,316,41,55,19,8,Thomas Boyland Street and Newport Street,Brooklyn,2025-05-29T00:00:00.000,-73.910949,40.659066,X,AREA OF MINIMAL FLOOD HAZARD,5.0,Brownsville
POINT (-73.89621158046498 40.81631071988179),2,Bronx,202,17,85,32,14,Southern Boulevard and Longwood Avenue,Bronx,2022-06-02T00:00:00.000,-73.896213,40.816319,X,AREA OF MINIMAL FLOOD HAZARD,6.0,Longwood
POINT (-73.97320755696897 40.79524372592407),1,Manhattan,107,7,69,47,12,West End Avenue and West  96 Street,Manhattan,2024-02-26T00:00:00.000,-73.973209,40.795252,X,AREA OF MINIMAL FLOOD HAZARD,,Upper West Side (Central)
POINT (-73.94438557142323 40.714524741146555),3,Brooklyn,301,34,50,18,7,Metropolitan Avenue and Graham Avenue,Brooklyn,2025-06-27T00:00:00.000,-73.944387,40.714533,X,AREA OF MINIMAL FLOOD HAZARD,,East Williamsburg
POINT (-73.75468959894883 40.6999954259521),4,Queens,412,27,33,14,5,Murdock Avenue and 200 Street,Queens,2024-04-18T00:00:00.000,-73.7546909659,40.7000036893,X,AREA OF MINIMAL FLOOD HAZARD,,St. Albans
POINT (-74.1063935275766 40.57381177469067),5,Staten Island,502,50,64,24,11,Hylan Boulevard and Bryant Avenue and Driveway,Staten Island,2024-07-09T00:00:00.000,-74.106395,40.57382,X,AREA OF MINIMAL FLOOD HAZARD,3.0,New Dorp-Midland Beach
POINT (-74.13203951809625 40.60774776865251),5,Staten Island,502,49,63,24,11,Bradley Avenue and South Gannon Avenue,Staten Island,2023-10-31T00:00:00.000,-74.132041,40.607756,X,AREA OF MINIMAL FLOOD HAZARD,,Todt Hill-Emerson Hill-Lighthouse Hill-Manor Heights
POINT (-73.91531558506374 40.6396297546833),3,Brooklyn,318,46,59,19,8,Farragut Road and East 82 Street,Brooklyn,2021-02-22T00:00:00.000,-73.915317,40.639638,X,AREA OF MINIMAL FLOOD HAZARD,3.0,Canarsie
POINT (-74.16983250740105 40.570871777059864),5,Staten Island,502,51,63,24,11,Richmond Avenue and Forest Hill Road,Staten Island,2024-09-12T00:00:00.000,-74.169834,40.57088,X,AREA OF MINIMAL FLOOD HAZARD,3.0,New Springville-Willowbrook-Bulls Head-Travis
POINT (-74.1872725030929 40.56404877879359),5,Staten Island,503,51,62,24,11,Arthur Kill Road and Ilyssa Way,Staten Island,2023-04-17T00:00:00.000,-74.187274,40.564057,X,AREA OF MINIMAL FLOOD HAZARD,,Arden Heights-Rossville
POINT (-74.01578354827971 40.71156174436261),1,Manhattan,101,1,61,27,10,Liberty Street and South End Avenue,Manhattan,2025-05-05T00:00:00.000,-74.015785,40.71157,X,0.2 PCT ANNUAL CHANCE FLOOD HAZARD,1.0,Financial District-Battery Park City
POINT (-73.90144057934486 40.81288972073573),2,Bronx,202,17,84,29,14,Southern Boulevard and Avenue Saint John,Bronx,2024-02-12T00:00:00.000,-73.901442,40.812898,X,AREA OF MINIMAL FLOOD HAZARD,6.0,Longwood
POINT (-73.81028361554579 40.69203974091855),4,Queens,412,28,32,10,5,Van Wyck Expressway East S/R and Liberty Avenue,Queens,2024-01-10T00:00:00.000,-73.810285,40.692048,X,AREA OF MINIMAL FLOOD HAZARD,,South Jamaica
POINT (-74.12059352112132 40.60180176927978),5,Staten Island,502,50,64,24,11,Manor Road and Ocean Terrace,Staten Island,2024-10-25T00:00:00.000,-74.120595,40.60181,X,AREA OF MINIMAL FLOOD HAZARD,,Todt Hill-Emerson Hill-Lighthouse Hill-Manor Heights
POINT (-73.84203760091326 40.76364072831886),4,Queens,481,21,27,11,14,Marina Road  and Harper Street,Queens,2018-05-10T00:00:00.000,-73.842039,40.763649,AE,,1.0,Flushing-Willets Point
POINT (-74.15015951513863 40.55075978027232),5,Staten Island,503,51,64,24,11,Amboy Road with Giffords Lane and Brown Avenue,Staten Island,2023-06-08T00:00:00.000,-74.150161,40.550768,X,AREA OF MINIMAL FLOOD HAZARD,,Great Kills-Eltingville
POINT (-74.00498355423339 40.6803097499176),3,Brooklyn,306,38,51,26,10,Hamilton Avenue Eastbound and Columbia Street,Brooklyn,2023-05-01T00:00:00.000,-74.004985,40.680318,X,0.2 PCT ANNUAL CHANCE FLOOD HAZARD,2.0,Carroll Gardens-Cobble Hill-Gowanus-Red Hook
POINT (-73.99373755371181 40.74160973782337),1,Manhattan,104,3,75,28,12,6 Avenue and West  21 Street,Manhattan,2025-09-05T00:00:00.000,-73.993739,40.741618,X,AREA OF MINIMAL FLOOD HAZARD,,Midtown South-Flatiron-Union Square
POINT (-73.89433557879815 40.846478713255),2,Bronx,206,15,86,32,15,East Tremont Avenue and La Fontaine Avenue,Bronx,2024-10-23T00:00:00.000,-73.894337,40.846487,X,AREA OF MINIMAL FLOOD HAZARD,,Tremont
POINT (-74.13765951613036 40.6032567700038),5,Staten Island,502,50,63,24,11,Willowbrook Road and Sheraden Avenue,Staten Island,2025-09-16T00:00:00.000,-74.137661,40.603265,X,AREA OF MINIMAL FLOOD HAZARD,,Todt Hill-Emerson Hill-Lighthouse Hill-Manor Heights
POINT (-73.96983155861975 40.784601727878126),1,Manhattan,107,6,69,47,12,Central Park West and West 85 Street,Manhattan,2023-08-15T00:00:00.000,-73.969833,40.78461,X,AREA OF MINIMAL FLOOD HAZARD,,Central Park
POINT (-74.00810055041373 40.71198474402675),1,Manhattan,101,1,66,27,10,Broadway with Barclay Street and Park Row,Manhattan,2025-01-16T00:00:00.000,-74.008102,40.711993,X,AREA OF MINIMAL FLOOD HAZARD,5.0,Tribeca-Civic Center
POINT (-74.1929384989689 40.59039277447127),5,Staten Island,502,50,62,24,11,Victory Boulevard and West Shore Expressway East S/R,Staten Island,2025-01-10T00:00:00.000,-74.19294,40.590401,X,AREA OF MINIMAL FLOOD HAZARD,5.0,New Springville-Willowbrook-Bulls Head-Travis
POINT (-74.11581052018641 40.64162376131872),5,Staten Island,501,49,61,23,11,Richmond Terrace and North Burger Avenue,Staten Island,2024-04-24T00:00:00.000,-74.115812,40.641632,X,AREA OF MINIMAL FLOOD HAZARD,4.0,West New Brighton-Silver Lake-Grymes Hill
POINT (-73.88278558326301 40.84128771427531),2,Bronx,206,15,87,32,15,East Tremont Avenue and Vyse Avenue,Bronx,2023-09-14T00:00:00.000,-73.882787,40.841296,X,AREA OF MINIMAL FLOOD HAZARD,,West Farms
POINT (-73.91287658196185 40.70586974141312),4,Queens,405,34,38,18,7,Seneca Avenue and Harman Street,Queens,2024-02-22T00:00:00.000,-73.912878,40.705878,X,AREA OF MINIMAL FLOOD HAZARD,,Ridgewood
POINT (-73.92148557216385 40.811024721209684),2,Bronx,201,8,84,29,14,Willis Avenue and East 141 Street,Bronx,2024-03-13T00:00:00.000,-73.921487,40.811033,X,AREA OF MINIMAL FLOOD HAZARD,6.0,Mott Haven-Port Morris
POINT (-73.9201825843847 40.62863475752451),3,Brooklyn,318,46,59,21,8,Avenue J and East  58 Street,Brooklyn,2022-10-26T00:00:00.000,-73.920184,40.628643,X,AREA OF MINIMAL FLOOD HAZARD,3.0,Flatlands
POINT (-73.95089157235546 40.66311775181555),3,Brooklyn,309,40,43,20,9,Nostrand Avenue and Sterling Street,Brooklyn,2025-01-12T00:00:00.000,-73.950893,40.663126,X,AREA OF MINIMAL FLOOD HAZARD,,Prospect Lefferts Gardens-Wingate
POINT (-73.97418256734714 40.60945376234522),3,Brooklyn,311,44,47,17,9,65 Street and Dahill Road,Brooklyn,2021-01-06T00:00:00.000,-73.974184,40.609462,X,AREA OF MINIMAL FLOOD HAZARD,,Bensonhurst
POINT (-73.81764861328149 40.68874174194125),4,Queens,410,28,24,15,5,Liberty Avenue and 127 Street,Queens,2021-07-23T00:00:00.000,-73.81765,40.68875,X,AREA OF MINIMAL FLOOD HAZARD,,South Ozone Park
POINT (-73.77161862738839 40.69941173813341),4,Queens,412,27,29,14,5,Dunkirk Street and Wood Street,Queens,2021-05-05T00:00:00.000,-73.77162,40.69942,X,AREA OF MINIMAL FLOOD HAZARD,,St. Albans
POINT (-73.788287612777 40.850900709240996),2,Bronx,210,13,82,34,14,City Island Avenue and Bowne Street,Bronx,2020-02-26T00:00:00.000,-73.788289,40.850909,AE,,1.0,Pelham Bay-Country Club-City Island
POINT (-73.89683457842075 40.84535271346557),2,Bronx,206,15,86,32,15,3 Avenue and East 176 Street,Bronx,2020-10-28T00:00:00.000,-73.896836,40.845361,X,AREA OF MINIMAL FLOOD HAZARD,,Tremont
POINT (-73.93397757103676 40.762818731037335),4,Queens,401,26,36,59,7,21 Street and  34 Avenue,Queens,2020-03-05T00:00:00.000,-73.933979,40.762827,X,AREA OF MINIMAL FLOOD HAZARD,4.0,Queensbridge-Ravenswood-Dutch Kills
POINT (-73.96125756010986 40.81607872160528),1,Manhattan,109,7,70,30,13,Riverside Drive East and NB Triangle,Manhattan,2018-05-17T00:00:00.000,-73.961259,40.816087,X,AREA OF MINIMAL FLOOD HAZARD,,Morningside Heights
POINT (-73.9139645731098 40.8486027135123),2,Bronx,205,14,77,31,15,West 176 Street and Grand Avenue,Bronx,2025-11-24T00:00:00.000,-73.913966,40.848611,X,AREA OF MINIMAL FLOOD HAZARD,,University Heights (South)-Morris Heights
POINT (-73.78787462376003 40.67329974340939),4,Queens,412,28,32,10,5,Sutphin Boulevard and 100' north of Rockaway Boulevard,Queens,2023-03-06T00:00:00.000,-73.787876,40.673308,X,AREA OF MINIMAL FLOOD HAZARD,4.0,Baisley Park
POINT (-73.89935558533196 40.7103137403952),4,Queens,405,30,37,12,7,Fresh Pond Road and Grove Street,Queens,2024-06-17T00:00:00.000,-73.899357,40.710322,X,AREA OF MINIMAL FLOOD HAZARD,,Ridgewood
