the_geom,borocode,boroname,borocd,coundist,assemdist,stsendist,congdist,location,borough,date_insta,point_x,point_y,femafldz,femafldt,hrcevac,ntaname
POINT (-73.95007957124129 40.67430574899309),3,Brooklyn,308,36,43,20,9,Nostrand Avenue and Prospect Place,Brooklyn,2023-10-24T00:00:00.000,-73.950081,40.674314,X,AREA OF MINIMAL FLOOD HAZARD,,Crown Heights (North)
POINT (-73.91954257311642 40.816545720673076),2,Bronx,201,17,84,29,15,Courtlandt Avenue and East 149 Street,Bronx,2024-01-27T00:00:00.000,-73.919544,40.816554,X,AREA OF MINIMAL FLOOD HAZARD,,Melrose
POINT (-73.96277357082607 40.62745975922299),3,Brooklyn,314,44,48,22,9,Avenue I and East  14 Street,Brooklyn,2025-10-17T00:00:00.000,-73.962775,40.627468,X,AREA OF MINIMAL FLOOD HAZARD,,Midwood
POINT (-74.0962305286397 40.61571276587155),5,Staten Island,501,49,63,24,11,Howard Avenue and Campus Road,Staten Island,2023-10-20T00:00:00.000,-74.096232,40.615721,X,AREA OF MINIMAL FLOOD HAZARD,,West New Brighton-Silver Lake-Grymes Hill
POINT (-73.94935857589593 40.6092207617288),3,Brooklyn,315,48,41,22,9,Quentin Road and East  24 Street,Brooklyn,2020-06-26T00:00:00.000,-73.94936,40.609229,X,AREA OF MINIMAL FLOOD HAZARD,4.0,Madison
POINT (-73.86759859763781 40.67342174662587),3,Brooklyn,305,42,60,19,7,Sutter Avenue and Autumn Avenue,Brooklyn,2021-08-31T00:00:00.000,-73.8676,40.67343,X,AREA OF MINIMAL FLOOD HAZARD,5.0,East New York-City Line
POINT (-73.98848955755915 40.71272274263582),1,Manhattan,103,1,65,27,10,Madison Street and Jefferson Street,Manhattan,2014-06-20T00:00:00.000,-73.988491,40.712731,X,AREA OF MINIMAL FLOOD HAZARD,3.0,Chinatown-Two Bridges
POINT (-73.8404605938605 40.88061570490176),2,Bronx,212,12,83,36,15,Boston Road and Grace Avenue,Bronx,2023-11-01T00:00:00.000,-73.840462,40.880624,X,AREA OF MINIMAL FLOOD HAZARD,,Eastchester-Edenwald-Baychester
POINT (-74.11667652260687 40.61011376796229),5,Staten Island,502,49,63,24,11,Slosson Avenue and Lortel Avenue,Staten Island,2024-09-27T00:00:00.000,-74.116678,40.610122,X,AREA OF MINIMAL FLOOD HAZARD,,Todt Hill-Emerson Hill-Lighthouse Hill-Manor Heights
POINT (-74.16421050880979 40.58698277358619),5,Staten Island,502,51,63,24,11,Richmond Hill Road and Ring Road,Staten Island,2022-09-23T00:00:00.000,-74.164212,40.586991,X,AREA OF MINIMAL FLOOD HAZARD,,New Springville-Willowbrook-Bulls Head-Travis
POINT (-73.96884155917651 40.78596072794846),1,Manhattan,164,6,69,47,12,Central Park West and West  87 Street,Manhattan,2023-05-08T00:00:00.000,-73.968843,40.785969,X,AREA OF MINIMAL FLOOD HAZARD,,Central Park
POINT (-73.94957057344871 40.65079875404772),3,Brooklyn,317,40,42,21,9,Nostrand Avenue and Church Avenue,Brooklyn,2022-03-17T00:00:00.000,-73.949572,40.650807,X,AREA OF MINIMAL FLOOD HAZARD,,East Flatbush-Erasmus
POINT (-74.11693852219071 40.612147767569134),5,Staten Island,501,49,63,24,11,Slosson Avenue and Windsor Road,Staten Island,2024-06-25T00:00:00.000,-74.11694,40.612156,X,AREA OF MINIMAL FLOOD HAZARD,,Westerleigh-Castleton Corners
POINT (-73.93718056661447 40.819133720319606),1,Manhattan,110,9,70,30,13,Lenox Avenue and West 143 Street,Manhattan,2024-04-09T00:00:00.000,-73.937182,40.819142,X,AREA OF MINIMAL FLOOD HAZARD,2.0,Harlem (North)
POINT (-74.03484154875365 40.61142476483165),3,Brooklyn,310,47,46,26,11,4 Avenue and Shore Road,Brooklyn,2025-11-07T00:00:00.000,-74.034843,40.611433,X,AREA OF MINIMAL FLOOD HAZARD,,Bay Ridge
POINT (-74.15295151382105 40.56678677736906),5,Staten Island,503,51,62,24,11,Arthur Kill Road and Corbin Avenue,Staten Island,2023-04-06T00:00:00.000,-74.152953,40.566795,X,AREA OF MINIMAL FLOOD HAZARD,1.0,Todt Hill-Emerson Hill-Lighthouse Hill-Manor Heights
POINT (-73.98582956614888 40.5765017693776),3,Brooklyn,313,47,46,23,8,Mermaid Avenue and West  19 Street,Brooklyn,2023-02-01T00:00:00.000,-73.985831,40.57651,AE,,1.0,Coney Island-Sea Gate
POINT (-73.8934785891839 40.67777174682331),3,Brooklyn,305,37,54,18,7,Fulton Street and Bradford Street,Brooklyn,2021-04-13T00:00:00.000,-73.89348,40.67778,X,AREA OF MINIMAL FLOOD HAZARD,,Cypress Hills
POINT (-74.11966852051373 40.621737765701646),5,Staten Island,501,50,63,24,11,Slosson Avenue and Martling Avenue,Staten Island,2023-07-28T00:00:00.000,-74.11967,40.621746,X,AREA OF MINIMAL FLOOD HAZARD,,Westerleigh-Castleton Corners
POINT (-73.89347357921534 40.84285471410776),2,Bronx,206,15,79,32,15,Crotona Avenue and East 175 Street,Bronx,2022-09-30T00:00:00.000,-73.893475,40.842863,X,AREA OF MINIMAL FLOOD HAZARD,,Tremont
POINT (-73.89449257701585 40.88534270579068),2,Bronx,208,11,81,31,13,Van Cortlandt Park South with Bailey Avenue and Deegan Expressway N/B Ramps,Bronx,2023-05-25T00:00:00.000,-73.894494,40.885351,X,AREA OF MINIMAL FLOOD HAZARD,,Kingsbridge Heights-Van Cortlandt Village
POINT (-73.92411957865123 40.689998745295064),3,Brooklyn,303,41,56,25,8,Ralph Avenue and Quincy Street,Brooklyn,2023-10-02T00:00:00.000,-73.924121,40.690007,X,AREA OF MINIMAL FLOOD HAZARD,,Bedford-Stuyvesant (East)
POINT (-73.90192858583886 40.69758274314575),4,Queens,405,34,38,12,7,Cypress Avenue and Stephen Street,Queens,2022-11-07T00:00:00.000,-73.90193,40.697591,X,AREA OF MINIMAL FLOOD HAZARD,,Ridgewood
POINT (-73.92436358357105 40.61145476054383),3,Brooklyn,318,46,59,22,8,Flatbush Avenue and Avenue T,Brooklyn,2020-06-02T00:00:00.000,-73.924365,40.611463,X,AREA OF MINIMAL FLOOD HAZARD,3.0,Marine Park-Mill Basin-Bergen Beach
POINT (-73.7848116220757 40.7079227371082),4,Queens,412,27,29,11,5,Jamaica Avenue and 176 Street (west leg),Queens,2025-11-14T00:00:00.000,-73.784813,40.707931,X,AREA OF MINIMAL FLOOD HAZARD,,Jamaica
POINT (-73.96864056078357 40.76159273261393),1,Manhattan,105,4,73,28,12,Lexington Avenue and East  58 Street,Manhattan,2024-03-29T00:00:00.000,-73.968642,40.761601,X,AREA OF MINIMAL FLOOD HAZARD,,East Midtown-Turtle Bay
POINT (-73.96327657316691 40.577204768740195),3,Brooklyn,313,48,46,23,8,Brighton Beach Avenue and Brighton  4 Street,Brooklyn,2022-02-28T00:00:00.000,-73.963278,40.577213,X,0.2 PCT ANNUAL CHANCE FLOOD HAZARD,1.0,Brighton Beach
POINT (-73.9104145820676 40.711772740740045),4,Queens,405,34,37,12,7,Grandview Avenue and Amory Court,Queens,2022-12-19T00:00:00.000,-73.910416,40.711781,X,AREA OF MINIMAL FLOOD HAZARD,,Ridgewood
POINT (-73.88863257865162 40.8827577060801),2,Bronx,208,11,81,31,13,Sedgwick Avenue and Dickinson Avenue,Bronx,2019-01-04T00:00:00.000,-73.888634,40.882766,X,AREA OF MINIMAL FLOOD HAZARD,,Bedford Park
POINT (-73.91753157260891 40.827242718096684),2,Bronx,204,16,79,32,15,Morris Avenue and East 163 Street,Bronx,2024-05-20T00:00:00.000,-73.917533,40.827251,X,AREA OF MINIMAL FLOOD HAZARD,,Concourse-Concourse Village
POINT (-73.96205756004107 40.81052672285343),1,Manhattan,109,7,69,30,13,Broadway and West 120 Street,Manhattan,2022-10-18T00:00:00.000,-73.962059,40.810535,X,AREA OF MINIMAL FLOOD HAZARD,,Morningside Heights
POINT (-73.98157055617864 40.773592730820795),1,Manhattan,107,6,75,47,12,Columbus Avenue and West  66 Street,Manhattan,2016-08-04T00:00:00.000,-73.981572,40.773601,X,AREA OF MINIMAL FLOOD HAZARD,,Upper West Side-Lincoln Square
POINT (-73.92790657468407 40.752041732834),4,Queens,401,26,36,12,7,Northern Boulevard and  36 Street,Queens,2024-07-23T00:00:00.000,-73.927908,40.75205,X,AREA OF MINIMAL FLOOD HAZARD,5.0,Sunnyside Yards (North)
POINT (-74.10913052687398 40.57962377346585),5,Staten Island,502,50,64,24,11,Lincoln Avenue and North Railroad Avenue,Staten Island,2023-07-05T00:00:00.000,-74.109132,40.579632,X,AREA OF MINIMAL FLOOD HAZARD,,New Dorp-Midland Beach
POINT (-73.87611058526285 40.84206371372069),2,Bronx,206,15,87,32,15,East 180 Street and Devoe Avenue,Bronx,2022-07-09T00:00:00.000,-73.876112,40.842072,X,AREA OF MINIMAL FLOOD HAZARD,4.0,West Farms
POINT (-73.87687459071982 40.750521731571595),4,Queens,403,21,34,13,14,37 Avenue and  90 Street,Queens,2022-06-28T00:00:00.000,-73.876876,40.75053,X,AREA OF MINIMAL FLOOD HAZARD,,Jackson Heights
POINT (-73.9788895643902 40.63432675788094),3,Brooklyn,312,39,44,22,9,Dahill Road and  41 Street,Brooklyn,2023-11-30T00:00:00.000,-73.978891,40.634335,X,AREA OF MINIMAL FLOOD HAZARD,,Borough Park
POINT (-73.85101459179963 40.86533870793899),2,Bronx,211,13,80,36,15,Allerton Avenue and Throop Avenue,Bronx,2023-12-05T00:00:00.000,-73.851016,40.865347,X,AREA OF MINIMAL FLOOD HAZARD,,Pelham Gardens
POINT (-73.81607348967702 40.69048401145183),4,Queens,"410, 409",29,24,15,5,103 Avenue and 130 Street,Queens,2024-10-08T00:00:00.000,-73.8160748759,40.6904922705,X,AREA OF MINIMAL FLOOD HAZARD,,South Ozone Park
POINT (-73.9195385818523 40.67353374806882),3,Brooklyn,316,41,55,25,9,Howard Avenue and Saint Marks Avenue,Brooklyn,2025-02-25T00:00:00.000,-73.91954,40.673542,X,AREA OF MINIMAL FLOOD HAZARD,,Ocean Hill
POINT (-73.95635556920212 40.690790745847046),3,Brooklyn,303,36,57,25,8,Dekalb Avenue and Skillman Street,Brooklyn,2021-01-28T00:00:00.000,-73.956357,40.690799,X,AREA OF MINIMAL FLOOD HAZARD,,Bedford-Stuyvesant (West)
POINT (-74.07643953530253 40.60677376720897),5,Staten Island,501,49,63,23,11,Hylan Boulevard East and Narrows Road North,Staten Island,2023-12-20T00:00:00.000,-74.076441,40.606782,X,AREA OF MINIMAL FLOOD HAZARD,,Rosebank-Shore Acres-Park Hill
POINT (-74.07825653438049 40.62198076390735),5,Staten Island,501,49,61,23,11,Tompkins Avenue and Hill Street,Staten Island,2015-10-19T00:00:00.000,-74.078258,40.621989,X,AREA OF MINIMAL FLOOD HAZARD,,Tompkinsville-Stapleton-Clifton-Fox Hills
POINT (-73.85294759826022 40.746158731658554),4,Queens,404,21,39,13,6,111 Street and  49 Avenue,Queens,2023-12-18T00:00:00.000,-73.852949,40.746167,X,AREA OF MINIMAL FLOOD HAZARD,6.0,Corona
POINT (-73.92170869286853 40.86065846528466),1,Manhattan,112,10,72,31,13,10 Avenue and West 201 Street,Manhattan,2024-09-20T00:00:00.000,-73.9217101234,40.8606667536,AE,,2.0,Inwood
POINT (-73.97207756665397 40.64584975566198),3,Brooklyn,312,40,44,21,9,Church Avenue and East 8 Street (South Leg),Brooklyn,2023-10-05T00:00:00.000,-73.972079,40.645858,X,AREA OF MINIMAL FLOOD HAZARD,,Kensington
POINT (-73.82963560567312 40.75854172848011),4,Queens,407,20,40,16,6,Main Street with Kissena Boulevard and 41 Avenue,Queens,2023-10-12T00:00:00.000,-73.829637,40.75855,X,AREA OF MINIMAL FLOOD HAZARD,5.0,Flushing-Willets Point
POINT (-73.91995958466525 40.62629675770426),3,Brooklyn,318,46,59,21,8,Avenue K and East 58 Street,Brooklyn,2022-12-08T00:00:00.000,-73.919961,40.626305,X,AREA OF MINIMAL FLOOD HAZARD,3.0,Flatlands
POINT (-73.92362157011326 40.8442287152286),2,Bronx,204,16,77,29,15,University Avenue and Ogden Avenue,Bronx,2023-09-18T00:00:00.000,-73.923623,40.844237,X,AREA OF MINIMAL FLOOD HAZARD,,Highbridge
POINT (-73.91138658679918 40.619885758941244),3,Brooklyn,318,46,59,21,8,Veterans Avenue with East 68 Street and Avenue T,Brooklyn,2023-04-24T00:00:00.000,-73.911388,40.619894,X,AREA OF MINIMAL FLOOD HAZARD,3.0,Marine Park-Mill Basin-Bergen Beach
POINT (-73.93611457203211 40.749704734043114),4,Queens,401,26,36,59,7,Northern Boulevard and  41 Avenue,Queens,2024-06-06T00:00:00.000,-73.936116,40.749713,X,AREA OF MINIMAL FLOOD HAZARD,6.0,Queensbridge-Ravenswood-Dutch Kills
POINT (-73.93439257868636 40.634821756266454),3,Brooklyn,317,45,58,21,9,Glenwood Road and Troy Avenue,Brooklyn,2023-09-26T00:00:00.000,-73.934394,40.63483,X,AREA OF MINIMAL FLOOD HAZARD,4.0,Flatlands
POINT (-73.7961506257788 40.59284075989068),4,Queens,414,31,31,10,5,Beach Channel Drive and Beach  67 Street,Queens,2025-07-25T00:00:00.000,-73.796152,40.592849,AE,,1.0,Rockaway Beach-Arverne-Edgemere
POINT (-74.00898454850058 40.7415277384676),1,Manhattan,102,3,66,47,10,West Street and West 13 Street,Manhattan,2023-06-13T00:00:00.000,-74.008986,40.741536,AE,,2.0,West Village
POINT (-73.90018258492506 40.71189574042077),4,Queens,405,30,37,12,7,Fresh Pond Road and Bleeker Street,Queens,2025-03-20T00:00:00.000,-73.900184,40.711904,X,AREA OF MINIMAL FLOOD HAZARD,,Ridgewood
POINT (-73.85878759216045 40.82419971681692),2,Bronx,209,18,85,34,14,White Plains Road and Story Avenue,Bronx,2023-09-07T00:00:00.000,-73.858789,40.824208,X,AREA OF MINIMAL FLOOD HAZARD,4.0,Soundview-Clason Point
POINT (-74.06712953870537 40.60698076660501),5,Staten Island,501,49,64,23,11,Tompkins Avenue and Fingerboard Road,Staten Island,2023-11-21T00:00:00.000,-74.067131,40.606989,X,AREA OF MINIMAL FLOOD HAZARD,,Rosebank-Shore Acres-Park Hill
POINT (-73.79892062054634 40.674156744373285),4,Queens,412,28,32,10,5,Rockaway Boulevard and 142 Street,Queens,2019-10-07T00:00:00.000,-73.798922,40.674165,X,AREA OF MINIMAL FLOOD HAZARD,6.0,Baisley Park
POINT (-73.96476857040383 40.612313762166615),3,Brooklyn,312,44,45,22,9,Avenue O and East   9 Street,Brooklyn,2025-10-03T00:00:00.000,-73.96477,40.612322,X,AREA OF MINIMAL FLOOD HAZARD,6.0,Gravesend (East)-Homecrest
POINT (-74.0028075510745 40.72837774002592),1,Manhattan,102,2,66,27,10,6 Avenue with West Houston Street and Bedford Street,Manhattan,2023-03-27T00:00:00.000,-74.002809,40.728386,X,AREA OF MINIMAL FLOOD HAZARD,5.0,Greenwich Village
POINT (-74.12715251958532 40.59832576991118),5,Staten Island,502,50,63,24,11,Brielle Avenue and Suffolk Avenue,Staten Island,2022-05-18T00:00:00.000,-74.127154,40.598334,X,AREA OF MINIMAL FLOOD HAZARD,,Todt Hill-Emerson Hill-Lighthouse Hill-Manor Heights
POINT (-73.82459760582842 40.78168772381185),4,Queens,407,19,27,11,3,20 Avenue and Whitestone Expressway S/B S/R,Queens,2018-11-29T00:00:00.000,-73.824599,40.781696,X,AREA OF MINIMAL FLOOD HAZARD,5.0,Murray Hill-Broadway Flushing
POINT (-74.00437084526455 40.60102403042247),3,Brooklyn,311,47,47,17,11,Cropsey Avenue and Bay 22 Street,Brooklyn,2025-07-29T00:00:00.000,-74.0043722865,40.6010322649,X,AREA OF MINIMAL FLOOD HAZARD,4.0,Bath Beach
POINT (-73.97099755751675 40.80095972475313),1,Manhattan,107,7,69,30,12,Riverside Drive and West 104 Street,Manhattan,2023-05-31T00:00:00.000,-73.970999,40.800968,X,AREA OF MINIMAL FLOOD HAZARD,,Upper West Side-Manhattan Valley
POINT (-73.90841557440345 40.852635713065894),2,Bronx,205,14,77,33,15,Jerome Avenue and East 179 Street,Bronx,2025-04-11T00:00:00.000,-73.908417,40.852644,X,AREA OF MINIMAL FLOOD HAZARD,,Mount Hope
POINT (-73.90764457457864 40.85085071337084),2,Bronx,205,14,86,33,15,East Tremont Avenue and Morris Avenue,Bronx,2024-12-03T00:00:00.000,-73.907646,40.850859,X,AREA OF MINIMAL FLOOD HAZARD,,Mount Hope
POINT (-73.92451958228466 40.63308275654752),3,Brooklyn,318,45,59,21,9,Avenue H and East  54 Street,Brooklyn,2024-01-11T00:00:00.000,-73.924521,40.633091,X,AREA OF MINIMAL FLOOD HAZARD,4.0,Flatlands
POINT (-73.98788855421043 40.75473973509872),1,Manhattan,105,3,75,28,12,7 Avenue and West  40 Street,Manhattan,2024-07-18T00:00:00.000,-73.98789,40.754748,X,AREA OF MINIMAL FLOOD HAZARD,,Midtown-Times Square
POINT (-73.81998760823971 40.75142172929128),4,Queens,407,20,25,16,6,Kissena Boulevard and Geranium Avenue,Queens,2022-08-03T00:00:00.000,-73.819989,40.75143,X,AREA OF MINIMAL FLOOD HAZARD,6.0,East Flushing
POINT (-73.97583656817947 40.59105676606862),3,Brooklyn,315,47,45,23,8,86 Street and Van Sicklen Street,Brooklyn,2021-06-04T00:00:00.000,-73.975838,40.591065,X,0.2 PCT ANNUAL CHANCE FLOOD HAZARD,2.0,Gravesend (East)-Homecrest
POINT (-73.8315376078179 40.71434973720917),4,Queens,406,29,28,14,5,Queens Boulevard Eastbound Service Road and Union Turnpike Southbound Service Road,Queens,2021-09-25T00:00:00.000,-73.831539,40.714358,X,AREA OF MINIMAL FLOOD HAZARD,,Forest Hills
POINT (-73.78381662285993 40.70792373638953),4,Queens,412,27,29,11,5,Jamaica Avenue with 177 Street and 178 Street,Queens,2024-08-12T00:00:00.000,-73.783818,40.707932,X,AREA OF MINIMAL FLOOD HAZARD,,Jamaica
POINT (-73.87135559207354 40.76232372935079),4,Queens,403,21,35,13,14,Astoria Boulevard and  98 Street,Queens,2025-05-08T00:00:00.000,-73.871357,40.762332,X,AREA OF MINIMAL FLOOD HAZARD,,East Elmhurst
POINT (-73.94681657210688 40.67947774833634),3,Brooklyn,303,36,56,20,8,New York Avenue and Herkimer Street,Brooklyn,2025-08-15T00:00:00.000,-73.946818,40.679486,X,AREA OF MINIMAL FLOOD HAZARD,,Bedford-Stuyvesant (West)
POINT (-73.8526016020516 40.694069741810566),4,Queens,409,32,38,15,7,Woodhaven Boulevard and  86 Drive (West Leg),Queens,2018-10-23T00:00:00.000,-73.852603,40.694078,X,AREA OF MINIMAL FLOOD HAZARD,,Woodhaven
POINT (-73.80355761738738 40.69696074001314),4,Queens,412,27,32,14,5,Liberty Avenue and 148 Street,Queens,2020-06-01T00:00:00.000,-73.803559,40.696969,X,AREA OF MINIMAL FLOOD HAZARD,6.0,Jamaica
POINT (-73.95987956044492 40.81764872128364),1,Manhattan,109,7,70,30,13,12 Avenue and West 125 Street,Manhattan,2022-03-09T00:00:00.000,-73.959881,40.817657,X,AREA OF MINIMAL FLOOD HAZARD,3.0,Manhattanville-West Harlem
POINT (-73.97896855909879 40.73616773794948),1,Manhattan,106,2,74,59,12,1  Avenue and East  22 Street,Manhattan,2017-05-24T00:00:00.000,-73.97897,40.736176,X,AREA OF MINIMAL FLOOD HAZARD,4.0,Gramercy
POINT (-73.91069757532283 40.822316718487485),2,Bronx,203,17,79,32,15,3rd Avenue and Brook Avenue,Bronx,2024-01-31T00:00:00.000,-73.910699,40.822325,X,AREA OF MINIMAL FLOOD HAZARD,6.0,Melrose
POINT (-74.13178452096626 40.55347777955759),5,Staten Island,503,51,64,24,11,Hylan Boulevard and Justin Avenue,Staten Island,2025-03-20T00:00:00.000,-74.131786,40.553486,X,AREA OF MINIMAL FLOOD HAZARD,1.0,Great Kills Park
POINT (-73.87898958230183 40.87957270667811),2,Bronx,207,11,81,33,15,Bainbridge Avenue and East 210 Street,Bronx,2023-08-04T00:00:00.000,-73.878991,40.879581,X,AREA OF MINIMAL FLOOD HAZARD,,Norwood
POINT (-74.00405655240397 40.71312674378526),1,Manhattan,101,1,65,27,10,Centre Street and Chambers Street,Manhattan,2021-09-03T00:00:00.000,-74.004058,40.713135,X,AREA OF MINIMAL FLOOD HAZARD,5.0,Tribeca-Civic Center
POINT (-73.96442355835282 40.81074672321113),1,Manhattan,109,7,69,30,13,Riverside Drive and West 119 Street,Manhattan,2023-07-12T00:00:00.000,-73.964425,40.810755,X,AREA OF MINIMAL FLOOD HAZARD,,Morningside Heights
POINT (-73.98783504639805 40.68249202696597),3,Brooklyn,306,39,52,26,10,Bond Street and Butler Street,Brooklyn,2025-06-19T00:00:00.000,-73.9878364873,40.6825002781,X,0.2 PCT ANNUAL CHANCE FLOOD HAZARD,2.0,Carroll Gardens-Cobble Hill-Gowanus-Red Hook
POINT (-73.99149455728292 40.6879527478582),3,Brooklyn,302,33,52,26,10,Boerum Place and Dean Street,Brooklyn,2022-09-21T00:00:00.000,-73.991496,40.687961,X,AREA OF MINIMAL FLOOD HAZARD,6.0,Downtown Brooklyn-DUMBO-Boerum Hill
POINT (-73.90141157685194 40.846855713467356),2,Bronx,205,15,86,32,15,Webster Avenue and East 176 Street,Bronx,2025-11-03T00:00:00.000,-73.901413,40.846864,X,AREA OF MINIMAL FLOOD HAZARD,,Mount Hope
POINT (-73.77762862806634 40.66413274484199),4,Queens,413,31,31,10,5,Rockaway Boulevard and 144 Drive,Queens,2025-10-17T00:00:00.000,-73.77763,40.664141,X,AREA OF MINIMAL FLOOD HAZARD,3.0,Springfield Gardens (South)-Brookville
POINT (-73.97985956485839 40.629442758995104),3,Brooklyn,312,44,48,22,9,18 Avenue and  47 Street,Brooklyn,2024-06-07T00:00:00.000,-73.979861,40.629451,X,AREA OF MINIMAL FLOOD HAZARD,,Borough Park
POINT (-73.90185957629365 40.85457971193449),2,Bronx,205,15,86,33,15,Grand Concourse and East 181 Street,Bronx,2024-03-25T00:00:00.000,-73.901861,40.854588,X,AREA OF MINIMAL FLOOD HAZARD,,Mount Hope
POINT (-73.8316705976934 40.86878470686406),2,Bronx,210,12,82,36,16,Bartow Avenue and Baychester Avenue,Bronx,2019-11-22T00:00:00.000,-73.831672,40.868793,X,AREA OF MINIMAL FLOOD HAZARD,4.0,Co-op City
POINT (-73.91267158517975 40.64623875313846),3,Brooklyn,318,42,58,19,9,Remsen Avenue and Avenue D,Brooklyn,2023-07-18T00:00:00.000,-73.912673,40.646247,X,AREA OF MINIMAL FLOOD HAZARD,5.0,Canarsie
POINT (-73.83908684347192 40.842195740629535),2,Bronx,211,13,82,34,14,Westchester Avenue and Waters Avenue,Bronx,2024-02-16T00:00:00.000,-73.8390882463,40.842204028,X,AREA OF MINIMAL FLOOD HAZARD,3.0,Hutchinson Metro Center
POINT (-74.14696551211681 40.61014276888967),5,Staten Island,501,50,63,24,11,Victory Boulevard and Willowbrook Road,Staten Island,2024-01-18T00:00:00.000,-74.146967,40.610151,X,AREA OF MINIMAL FLOOD HAZARD,,Westerleigh-Castleton Corners
POINT (-73.88681858175597 40.83705671476756),2,Bronx,203,17,79,32,15,Hoe Avenue and East 174 Street,Bronx,2024-02-08T00:00:00.000,-73.88682,40.837065,X,AREA OF MINIMAL FLOOD HAZARD,,Crotona Park East
POINT (-73.91290057104403 40.889739705590664),2,Bronx,208,11,81,33,15,Independence Avenue and West 239 Street,Bronx,2022-05-05T00:00:00.000,-73.912902,40.889748,X,AREA OF MINIMAL FLOOD HAZARD,,Riverdale-Spuyten Duyvil
POINT (-74.00734154951527 40.73358073975646),1,Manhattan,102,3,66,27,10,Greenwich Street and West  10 Street,Manhattan,2022-01-09T00:00:00.000,-74.007343,40.733589,X,AREA OF MINIMAL FLOOD HAZARD,5.0,West Village
POINT (-73.9135405787687 40.75345873260772),4,Queens,401,26,37,12,7,Northern Boulevard and  49 Street,Queens,2023-09-02T00:00:00.000,-73.913542,40.753467,X,AREA OF MINIMAL FLOOD HAZARD,,Sunnyside Yards (North)
POINT (-73.9727165566905 40.79591972583647),1,Manhattan,107,7,69,47,12,West End Avenue and West  97 Street,Manhattan,2019-09-10T00:00:00.000,-73.972718,40.795928,X,AREA OF MINIMAL FLOOD HAZARD,,Upper West Side (Central)
POINT (-74.07600353381493 40.6377397609761),5,Staten Island,501,49,61,23,11,Bay Street and Victory Boulevard,Staten Island,2024-03-11T00:00:00.000,-74.076005,40.637748,X,AREA OF MINIMAL FLOOD HAZARD,5.0,Tompkinsville-Stapleton-Clifton-Fox Hills
POINT (-73.85247859341065 40.837775714016665),2,Bronx,209,18,87,34,14,Castle Hill Avenue and St Raymond Avenue,Bronx,2025-04-21T00:00:00.000,-73.85248,40.837784,X,AREA OF MINIMAL FLOOD HAZARD,6.0,Parkchester
POINT (-73.76855363006554 40.67286274338786),4,Queens,412,28,32,10,5,137 Avenue and 172 Street,Queens,2017-04-07T00:00:00.000,-73.768555,40.672871,X,AREA OF MINIMAL FLOOD HAZARD,4.0,Springfield Gardens (North)-Rochdale Village
POINT (-73.79034062313653 40.6760297429461),4,Queens,412,28,32,10,5,Sutphin Boulevard and 123 Avenue,Queens,2024-03-04T00:00:00.000,-73.790342,40.676038,X,AREA OF MINIMAL FLOOD HAZARD,5.0,Baisley Park
POINT (-73.90311057273591 40.90385870286778),2,Bronx,208,11,81,33,15,Mosholu Avenue and West 256 Street,Bronx,2021-11-29T00:00:00.000,-73.903112,40.903867,X,AREA OF MINIMAL FLOOD HAZARD,,Riverdale-Spuyten Duyvil
POINT (-73.85705658875173 40.88173770496193),2,Bronx,212,12,83,36,15,Bronxwood Avenue and East 219 Street,Bronx,2010-02-03T00:00:00.000,-73.857058,40.881746,X,AREA OF MINIMAL FLOOD HAZARD,,Williamsbridge-Olinville
POINT (-73.74376263431637 40.73021873145687),4,Queens,413,23,33,11,3,Hillside Avenue and Braddock Avenue,Queens,2022-07-05T00:00:00.000,-73.743764,40.730227,X,AREA OF MINIMAL FLOOD HAZARD,,Queens Village
POINT (-73.81745760770103 40.77377372526371),4,Queens,407,19,40,16,3,149 Street and  27 Avenue,Queens,2023-12-15T00:00:00.000,-73.817459,40.773782,X,AREA OF MINIMAL FLOOD HAZARD,,Murray Hill-Broadway Flushing
POINT (-73.9132385826254 40.69131174500037),3,Brooklyn,304,37,54,18,7,Central Avenue and Jefferson Avenue,Brooklyn,2021-02-25T00:00:00.000,-73.91324,40.69132,X,AREA OF MINIMAL FLOOD HAZARD,,Bushwick (East)
POINT (-73.95861756141248 40.79996872522776),1,Manhattan,107,6,68,30,12,Central Park West and West 109 Street,Manhattan,2025-06-16T00:00:00.000,-73.958619,40.799977,X,AREA OF MINIMAL FLOOD HAZARD,,Central Park
POINT (-73.8470396008919 40.738635733330746),4,Queens,406,24,35,13,6,Horace Harding Expressway E/B S/R and Grand Central Parkway West /S/R,Queens,2020-01-10T00:00:00.000,-73.847041,40.738644,X,0.2 PCT ANNUAL CHANCE FLOOD HAZARD,2.0,Forest Hills
POINT (-73.8728045863693 40.840860714243725),2,Bronx,206,15,87,33,14,Morris Park Avenue and East 180 Street,Bronx,2020-08-14T00:00:00.000,-73.872806,40.840869,X,AREA OF MINIMAL FLOOD HAZARD,6.0,Pelham Parkway-Van Nest
POINT (-73.91789257016868 40.86227471138501),1,Manhattan,112,10,72,31,13,9 Avenue and West 205 Street,Manhattan,2023-07-05T00:00:00.000,-73.917894,40.862283,X,0.2 PCT ANNUAL CHANCE FLOOD HAZARD,2.0,Inwood
POINT (-73.8684565938418 40.74925573125461),4,Queens,403,21,34,13,14,Roosevelt Avenue and  97 Street,Queens,2022-09-09T00:00:00.000,-73.868458,40.749264,X,AREA OF MINIMAL FLOOD HAZARD,,Corona
POINT (-74.08741353127643 40.61592076556576),5,Staten Island,501,49,61,23,11,Van Duzer Street and Hillside Avenue,Staten Island,2023-08-25T00:00:00.000,-74.087415,40.615929,X,AREA OF MINIMAL FLOOD HAZARD,,Tompkinsville-Stapleton-Clifton-Fox Hills
POINT (-73.8800135932131 40.685235744793225),3,Brooklyn,305,37,54,18,7,Etna Street and Norwood Avenue,Brooklyn,2023-08-23T00:00:00.000,-73.880015,40.685244,X,AREA OF MINIMAL FLOOD HAZARD,,Cypress Hills
POINT (-73.97701856256151 40.68518774841949),3,Brooklyn,302,35,57,26,10,Hanson Place and Saint Felix Avenue,Brooklyn,2015-05-13T00:00:00.000,-73.97702,40.685196,X,AREA OF MINIMAL FLOOD HAZARD,,Fort Greene
POINT (-73.82758960589715 40.75729472822289),4,Queens,407,20,40,16,6,Kissena Boulevard and Barclay Avenue,Queens,2023-03-20T00:00:00.000,-73.827591,40.757303,X,AREA OF MINIMAL FLOOD HAZARD,,Flushing-Willets Point
POINT (-73.86848959395117 40.74758373240845),4,Queens,404,21,34,13,14,Junction Boulevard  and  41 Avenue (North Leg),Queens,2023-11-28T00:00:00.000,-73.868491,40.747592,X,AREA OF MINIMAL FLOOD HAZARD,,Corona
POINT (-73.94673457625491 40.61146176166292),3,Brooklyn,315,48,41,22,9,Avenue P and East 27 Street,Brooklyn,2023-03-23T00:00:00.000,-73.946736,40.61147,X,AREA OF MINIMAL FLOOD HAZARD,4.0,Madison
POINT (-73.96815256961452 40.611952761646805),3,Brooklyn,312,44,45,22,9,Ocean Parkway and Avenue O,Brooklyn,2022-05-23T00:00:00.000,-73.968154,40.611961,X,AREA OF MINIMAL FLOOD HAZARD,6.0,Mapleton-Midwood (West)
POINT (-73.9682235686218 40.63728775718312),3,Brooklyn,312,39,44,21,9,Coney Island Avenue and Dorchester Road,Brooklyn,2024-12-05T00:00:00.000,-73.968225,40.637296,X,AREA OF MINIMAL FLOOD HAZARD,,Kensington
